No.     Time           Source                Destination           Protocol Length Info
      1 0.000000000    10.0.0.2              10.0.0.1              TCP      74     36740 → 80 [SYN] Seq=0 Win=64240 Len=0 MSS=1460 SACK_PERM=1 TSval=1870786059 TSecr=0 WS=128

Frame 1: 74 bytes on wire (592 bits), 74 bytes captured (592 bits) on interface eth1, id 0
Ethernet II, Src: Parallel_51:85:63 (00:1c:42:51:85:63), Dst: Parallel_a7:d8:83 (00:1c:42:a7:d8:83)
Internet Protocol Version 4, Src: 10.0.0.2, Dst: 10.0.0.1
Transmission Control Protocol, Src Port: 36740, Dst Port: 80, Seq: 0, Len: 0

No.     Time           Source                Destination           Protocol Length Info
      2 0.000028144    10.0.0.1              10.0.0.2              TCP      74     80 → 36740 [SYN, ACK] Seq=0 Ack=1 Win=65160 Len=0 MSS=1460 SACK_PERM=1 TSval=313226713 TSecr=1870786059 WS=128

Frame 2: 74 bytes on wire (592 bits), 74 bytes captured (592 bits) on interface eth1, id 0
Ethernet II, Src: Parallel_a7:d8:83 (00:1c:42:a7:d8:83), Dst: Parallel_51:85:63 (00:1c:42:51:85:63)
Internet Protocol Version 4, Src: 10.0.0.1, Dst: 10.0.0.2
Transmission Control Protocol, Src Port: 80, Dst Port: 36740, Seq: 0, Ack: 1, Len: 0

No.     Time           Source                Destination           Protocol Length Info
      3 0.000238935    10.0.0.2              10.0.0.1              TCP      66     36740 → 80 [ACK] Seq=1 Ack=1 Win=64256 Len=0 TSval=1870786059 TSecr=313226713

Frame 3: 66 bytes on wire (528 bits), 66 bytes captured (528 bits) on interface eth1, id 0
Ethernet II, Src: Parallel_51:85:63 (00:1c:42:51:85:63), Dst: Parallel_a7:d8:83 (00:1c:42:a7:d8:83)
Internet Protocol Version 4, Src: 10.0.0.2, Dst: 10.0.0.1
Transmission Control Protocol, Src Port: 36740, Dst Port: 80, Seq: 1, Ack: 1, Len: 0

No.     Time           Source                Destination           Protocol Length Info
     21 14.257228804   10.0.0.2              10.0.0.1              TCP      82     36740 → 80 [PSH, ACK] Seq=1 Ack=1 Win=64256 Len=16 TSval=1870800316 TSecr=313226713 [TCP segment of a reassembled PDU]

Frame 21: 82 bytes on wire (656 bits), 82 bytes captured (656 bits) on interface eth1, id 0
Ethernet II, Src: Parallel_51:85:63 (00:1c:42:51:85:63), Dst: Parallel_a7:d8:83 (00:1c:42:a7:d8:83)
Internet Protocol Version 4, Src: 10.0.0.2, Dst: 10.0.0.1
Transmission Control Protocol, Src Port: 36740, Dst Port: 80, Seq: 1, Ack: 1, Len: 16

No.     Time           Source                Destination           Protocol Length Info
     22 14.257270236   10.0.0.1              10.0.0.2              TCP      66     80 → 36740 [ACK] Seq=1 Ack=17 Win=65152 Len=0 TSval=313240970 TSecr=1870800316

Frame 22: 66 bytes on wire (528 bits), 66 bytes captured (528 bits) on interface eth1, id 0
Ethernet II, Src: Parallel_a7:d8:83 (00:1c:42:a7:d8:83), Dst: Parallel_51:85:63 (00:1c:42:51:85:63)
Internet Protocol Version 4, Src: 10.0.0.1, Dst: 10.0.0.2
Transmission Control Protocol, Src Port: 80, Dst Port: 36740, Seq: 1, Ack: 17, Len: 0

No.     Time           Source                Destination           Protocol Length Info
     63 22.528849980   10.0.0.2              10.0.0.1              TCP      82     36740 → 80 [PSH, ACK] Seq=17 Ack=1 Win=64256 Len=16 TSval=1870808588 TSecr=313240970 [TCP segment of a reassembled PDU]

Frame 63: 82 bytes on wire (656 bits), 82 bytes captured (656 bits) on interface eth1, id 0
Ethernet II, Src: Parallel_51:85:63 (00:1c:42:51:85:63), Dst: Parallel_a7:d8:83 (00:1c:42:a7:d8:83)
Internet Protocol Version 4, Src: 10.0.0.2, Dst: 10.0.0.1
Transmission Control Protocol, Src Port: 36740, Dst Port: 80, Seq: 17, Ack: 1, Len: 16

No.     Time           Source                Destination           Protocol Length Info
     64 22.528869488   10.0.0.1              10.0.0.2              TCP      66     80 → 36740 [ACK] Seq=1 Ack=33 Win=65152 Len=0 TSval=313249242 TSecr=1870808588

Frame 64: 66 bytes on wire (528 bits), 66 bytes captured (528 bits) on interface eth1, id 0
Ethernet II, Src: Parallel_a7:d8:83 (00:1c:42:a7:d8:83), Dst: Parallel_51:85:63 (00:1c:42:51:85:63)
Internet Protocol Version 4, Src: 10.0.0.1, Dst: 10.0.0.2
Transmission Control Protocol, Src Port: 80, Dst Port: 36740, Seq: 1, Ack: 33, Len: 0

No.     Time           Source                Destination           Protocol Length Info
     69 25.398128406   10.0.0.2              10.0.0.1              HTTP     68     GET / HTTP/1.1 

Frame 69: 68 bytes on wire (544 bits), 68 bytes captured (544 bits) on interface eth1, id 0
Ethernet II, Src: Parallel_51:85:63 (00:1c:42:51:85:63), Dst: Parallel_a7:d8:83 (00:1c:42:a7:d8:83)
Internet Protocol Version 4, Src: 10.0.0.2, Dst: 10.0.0.1
Transmission Control Protocol, Src Port: 36740, Dst Port: 80, Seq: 33, Ack: 1, Len: 2
[3 Reassembled TCP Segments (34 bytes): #21(16), #63(16), #69(2)]
Hypertext Transfer Protocol

No.     Time           Source                Destination           Protocol Length Info
     70 25.398152490   10.0.0.1              10.0.0.2              TCP      66     80 → 36740 [ACK] Seq=1 Ack=35 Win=65152 Len=0 TSval=313252111 TSecr=1870811457

Frame 70: 66 bytes on wire (528 bits), 66 bytes captured (528 bits) on interface eth1, id 0
Ethernet II, Src: Parallel_a7:d8:83 (00:1c:42:a7:d8:83), Dst: Parallel_51:85:63 (00:1c:42:51:85:63)
Internet Protocol Version 4, Src: 10.0.0.1, Dst: 10.0.0.2
Transmission Control Protocol, Src Port: 80, Dst Port: 36740, Seq: 1, Ack: 35, Len: 0

No.     Time           Source                Destination           Protocol Length Info
     71 25.398365099   10.0.0.1              10.0.0.2              TCP      2962   80 → 36740 [PSH, ACK] Seq=1 Ack=35 Win=65152 Len=2896 TSval=313252112 TSecr=1870811457 [TCP segment of a reassembled PDU]

Frame 71: 2962 bytes on wire (23696 bits), 2962 bytes captured (23696 bits) on interface eth1, id 0
Ethernet II, Src: Parallel_a7:d8:83 (00:1c:42:a7:d8:83), Dst: Parallel_51:85:63 (00:1c:42:51:85:63)
Internet Protocol Version 4, Src: 10.0.0.1, Dst: 10.0.0.2
Transmission Control Protocol, Src Port: 80, Dst Port: 36740, Seq: 1, Ack: 35, Len: 2896

No.     Time           Source                Destination           Protocol Length Info
     72 25.398389806   10.0.0.1              10.0.0.2              TCP      2962   80 → 36740 [PSH, ACK] Seq=2897 Ack=35 Win=65152 Len=2896 TSval=313252112 TSecr=1870811457 [TCP segment of a reassembled PDU]

Frame 72: 2962 bytes on wire (23696 bits), 2962 bytes captured (23696 bits) on interface eth1, id 0
Ethernet II, Src: Parallel_a7:d8:83 (00:1c:42:a7:d8:83), Dst: Parallel_51:85:63 (00:1c:42:51:85:63)
Internet Protocol Version 4, Src: 10.0.0.1, Dst: 10.0.0.2
Transmission Control Protocol, Src Port: 80, Dst Port: 36740, Seq: 2897, Ack: 35, Len: 2896

No.     Time           Source                Destination           Protocol Length Info
     73 25.398453403   10.0.0.1              10.0.0.2              TCP      2962   80 → 36740 [PSH, ACK] Seq=5793 Ack=35 Win=65152 Len=2896 TSval=313252112 TSecr=1870811457 [TCP segment of a reassembled PDU]

Frame 73: 2962 bytes on wire (23696 bits), 2962 bytes captured (23696 bits) on interface eth1, id 0
Ethernet II, Src: Parallel_a7:d8:83 (00:1c:42:a7:d8:83), Dst: Parallel_51:85:63 (00:1c:42:51:85:63)
Internet Protocol Version 4, Src: 10.0.0.1, Dst: 10.0.0.2
Transmission Control Protocol, Src Port: 80, Dst Port: 36740, Seq: 5793, Ack: 35, Len: 2896

No.     Time           Source                Destination           Protocol Length Info
     74 25.398477270   10.0.0.1              10.0.0.2              HTTP     2551   HTTP/1.1 200 OK  (text/html)

Frame 74: 2551 bytes on wire (20408 bits), 2551 bytes captured (20408 bits) on interface eth1, id 0
Ethernet II, Src: Parallel_a7:d8:83 (00:1c:42:a7:d8:83), Dst: Parallel_51:85:63 (00:1c:42:51:85:63)
Internet Protocol Version 4, Src: 10.0.0.1, Dst: 10.0.0.2
Transmission Control Protocol, Src Port: 80, Dst Port: 36740, Seq: 8689, Ack: 35, Len: 2485
[4 Reassembled TCP Segments (11173 bytes): #71(2896), #72(2896), #73(2896), #74(2485)]
Hypertext Transfer Protocol
Line-based text data: text/html (375 lines)

No.     Time           Source                Destination           Protocol Length Info
     75 25.398671528   10.0.0.2              10.0.0.1              TCP      66     36740 → 80 [ACK] Seq=35 Ack=2897 Win=63488 Len=0 TSval=1870811458 TSecr=313252112

Frame 75: 66 bytes on wire (528 bits), 66 bytes captured (528 bits) on interface eth1, id 0
Ethernet II, Src: Parallel_51:85:63 (00:1c:42:51:85:63), Dst: Parallel_a7:d8:83 (00:1c:42:a7:d8:83)
Internet Protocol Version 4, Src: 10.0.0.2, Dst: 10.0.0.1
Transmission Control Protocol, Src Port: 36740, Dst Port: 80, Seq: 35, Ack: 2897, Len: 0

No.     Time           Source                Destination           Protocol Length Info
     76 25.398671594   10.0.0.2              10.0.0.1              TCP      66     36740 → 80 [ACK] Seq=35 Ack=5793 Win=61568 Len=0 TSval=1870811458 TSecr=313252112

Frame 76: 66 bytes on wire (528 bits), 66 bytes captured (528 bits) on interface eth1, id 0
Ethernet II, Src: Parallel_51:85:63 (00:1c:42:51:85:63), Dst: Parallel_a7:d8:83 (00:1c:42:a7:d8:83)
Internet Protocol Version 4, Src: 10.0.0.2, Dst: 10.0.0.1
Transmission Control Protocol, Src Port: 36740, Dst Port: 80, Seq: 35, Ack: 5793, Len: 0

No.     Time           Source                Destination           Protocol Length Info
     77 25.398732035   10.0.0.2              10.0.0.1              TCP      66     36740 → 80 [ACK] Seq=35 Ack=11174 Win=57600 Len=0 TSval=1870811458 TSecr=313252112

Frame 77: 66 bytes on wire (528 bits), 66 bytes captured (528 bits) on interface eth1, id 0
Ethernet II, Src: Parallel_51:85:63 (00:1c:42:51:85:63), Dst: Parallel_a7:d8:83 (00:1c:42:a7:d8:83)
Internet Protocol Version 4, Src: 10.0.0.2, Dst: 10.0.0.1
Transmission Control Protocol, Src Port: 36740, Dst Port: 80, Seq: 35, Ack: 11174, Len: 0

No.     Time           Source                Destination           Protocol Length Info
     80 30.404531733   10.0.0.1              10.0.0.2              TCP      66     80 → 36740 [FIN, ACK] Seq=11174 Ack=35 Win=65152 Len=0 TSval=313257118 TSecr=1870811458

Frame 80: 66 bytes on wire (528 bits), 66 bytes captured (528 bits) on interface eth1, id 0
Ethernet II, Src: Parallel_a7:d8:83 (00:1c:42:a7:d8:83), Dst: Parallel_51:85:63 (00:1c:42:51:85:63)
Internet Protocol Version 4, Src: 10.0.0.1, Dst: 10.0.0.2
Transmission Control Protocol, Src Port: 80, Dst Port: 36740, Seq: 11174, Ack: 35, Len: 0

No.     Time           Source                Destination           Protocol Length Info
     81 30.405217993   10.0.0.2              10.0.0.1              TCP      66     36740 → 80 [FIN, ACK] Seq=35 Ack=11175 Win=64128 Len=0 TSval=1870816464 TSecr=313257118

Frame 81: 66 bytes on wire (528 bits), 66 bytes captured (528 bits) on interface eth1, id 0
Ethernet II, Src: Parallel_51:85:63 (00:1c:42:51:85:63), Dst: Parallel_a7:d8:83 (00:1c:42:a7:d8:83)
Internet Protocol Version 4, Src: 10.0.0.2, Dst: 10.0.0.1
Transmission Control Protocol, Src Port: 36740, Dst Port: 80, Seq: 35, Ack: 11175, Len: 0

No.     Time           Source                Destination           Protocol Length Info
     82 30.405268076   10.0.0.1              10.0.0.2              TCP      66     80 → 36740 [ACK] Seq=11175 Ack=36 Win=65152 Len=0 TSval=313257118 TSecr=1870816464

Frame 82: 66 bytes on wire (528 bits), 66 bytes captured (528 bits) on interface eth1, id 0
Ethernet II, Src: Parallel_a7:d8:83 (00:1c:42:a7:d8:83), Dst: Parallel_51:85:63 (00:1c:42:51:85:63)
Internet Protocol Version 4, Src: 10.0.0.1, Dst: 10.0.0.2
Transmission Control Protocol, Src Port: 80, Dst Port: 36740, Seq: 11175, Ack: 36, Len: 0
