No.     Time           Source                Destination           Protocol Length Info
      1 0.000000000    192.168.21.128        192.168.21.2          DNS      101    Standard query 0x8c4b A incoming.telemetry.mozilla.org OPT

Frame 1: 101 bytes on wire (808 bits), 101 bytes captured (808 bits) on interface eth0, id 0
Ethernet II, Src: VMware_8e:ef:60 (00:0c:29:8e:ef:60), Dst: VMware_fb:0a:68 (00:50:56:fb:0a:68)
Internet Protocol Version 4, Src: 192.168.21.128, Dst: 192.168.21.2
User Datagram Protocol, Src Port: 49551, Dst Port: 53
    Source Port: 49551
    Destination Port: 53
    Length: 67
    Checksum: 0xac27 [unverified]
    [Checksum Status: Unverified]
    [Stream index: 0]
    [Timestamps]
Domain Name System (query)

No.     Time           Source                Destination           Protocol Length Info
      2 0.001924255    192.168.21.128        192.168.21.2          DNS      101    Standard query 0x1616 AAAA incoming.telemetry.mozilla.org OPT

Frame 2: 101 bytes on wire (808 bits), 101 bytes captured (808 bits) on interface eth0, id 0
Ethernet II, Src: VMware_8e:ef:60 (00:0c:29:8e:ef:60), Dst: VMware_fb:0a:68 (00:50:56:fb:0a:68)
Internet Protocol Version 4, Src: 192.168.21.128, Dst: 192.168.21.2
User Datagram Protocol, Src Port: 42937, Dst Port: 53
    Source Port: 42937
    Destination Port: 53
    Length: 67
    Checksum: 0xac27 [unverified]
    [Checksum Status: Unverified]
    [Stream index: 1]
    [Timestamps]
Domain Name System (query)

No.     Time           Source                Destination           Protocol Length Info
      3 0.023575654    192.168.21.2          192.168.21.128        DNS      233    Standard query response 0x8c4b A incoming.telemetry.mozilla.org CNAME telemetry-incoming.r53-2.services.mozilla.com CNAME prod.ingestion-edge.prod.dataops.mozgcp.net A 34.120.208.123 OPT

Frame 3: 233 bytes on wire (1864 bits), 233 bytes captured (1864 bits) on interface eth0, id 0
Ethernet II, Src: VMware_fb:0a:68 (00:50:56:fb:0a:68), Dst: VMware_8e:ef:60 (00:0c:29:8e:ef:60)
Internet Protocol Version 4, Src: 192.168.21.2, Dst: 192.168.21.128
User Datagram Protocol, Src Port: 53, Dst Port: 49551
    Source Port: 53
    Destination Port: 49551
    Length: 199
    Checksum: 0x2ab5 [unverified]
    [Checksum Status: Unverified]
    [Stream index: 0]
    [Timestamps]
Domain Name System (response)

No.     Time           Source                Destination           Protocol Length Info
      4 0.023575808    192.168.21.2          192.168.21.128        DNS      307    Standard query response 0x1616 AAAA incoming.telemetry.mozilla.org CNAME telemetry-incoming.r53-2.services.mozilla.com CNAME prod.ingestion-edge.prod.dataops.mozgcp.net SOA ns-cloud-b1.googledomains.com OPT

Frame 4: 307 bytes on wire (2456 bits), 307 bytes captured (2456 bits) on interface eth0, id 0
Ethernet II, Src: VMware_fb:0a:68 (00:50:56:fb:0a:68), Dst: VMware_8e:ef:60 (00:0c:29:8e:ef:60)
Internet Protocol Version 4, Src: 192.168.21.2, Dst: 192.168.21.128
User Datagram Protocol, Src Port: 53, Dst Port: 42937
    Source Port: 53
    Destination Port: 42937
    Length: 273
    Checksum: 0x0482 [unverified]
    [Checksum Status: Unverified]
    [Stream index: 1]
    [Timestamps]
Domain Name System (response)

No.     Time           Source                Destination           Protocol Length Info
      5 0.024075391    192.168.21.128        192.168.21.2          DNS      114    Standard query 0xe00d AAAA prod.ingestion-edge.prod.dataops.mozgcp.net OPT

Frame 5: 114 bytes on wire (912 bits), 114 bytes captured (912 bits) on interface eth0, id 0
Ethernet II, Src: VMware_8e:ef:60 (00:0c:29:8e:ef:60), Dst: VMware_fb:0a:68 (00:50:56:fb:0a:68)
Internet Protocol Version 4, Src: 192.168.21.128, Dst: 192.168.21.2
User Datagram Protocol, Src Port: 33009, Dst Port: 53
    Source Port: 33009
    Destination Port: 53
    Length: 80
    Checksum: 0xac34 [unverified]
    [Checksum Status: Unverified]
    [Stream index: 2]
    [Timestamps]
Domain Name System (query)

No.     Time           Source                Destination           Protocol Length Info
      6 0.024774422    192.168.21.128        34.120.208.123        TCP      74     32872 → 443 [SYN] Seq=0 Win=64240 Len=0 MSS=1460 SACK_PERM=1 TSval=3548506638 TSecr=0 WS=128

Frame 6: 74 bytes on wire (592 bits), 74 bytes captured (592 bits) on interface eth0, id 0
Ethernet II, Src: VMware_8e:ef:60 (00:0c:29:8e:ef:60), Dst: VMware_fb:0a:68 (00:50:56:fb:0a:68)
Internet Protocol Version 4, Src: 192.168.21.128, Dst: 34.120.208.123
Transmission Control Protocol, Src Port: 32872, Dst Port: 443, Seq: 0, Len: 0
    Source Port: 32872
    Destination Port: 443
    [Stream index: 0]
    [TCP Segment Len: 0]
    Sequence number: 0    (relative sequence number)
    Sequence number (raw): 295111981
    [Next sequence number: 1    (relative sequence number)]
    Acknowledgment number: 0
    Acknowledgment number (raw): 0
    1010 .... = Header Length: 40 bytes (10)
    Flags: 0x002 (SYN)
    Window size value: 64240
    [Calculated window size: 64240]
    Checksum: 0xc94a [unverified]
    [Checksum Status: Unverified]
    Urgent pointer: 0
    Options: (20 bytes), Maximum segment size, SACK permitted, Timestamps, No-Operation (NOP), Window scale
    [Timestamps]

No.     Time           Source                Destination           Protocol Length Info
      7 0.051282999    192.168.21.2          192.168.21.128        DNS      207    Standard query response 0xe00d AAAA prod.ingestion-edge.prod.dataops.mozgcp.net SOA ns-cloud-b1.googledomains.com OPT

Frame 7: 207 bytes on wire (1656 bits), 207 bytes captured (1656 bits) on interface eth0, id 0
Ethernet II, Src: VMware_fb:0a:68 (00:50:56:fb:0a:68), Dst: VMware_8e:ef:60 (00:0c:29:8e:ef:60)
Internet Protocol Version 4, Src: 192.168.21.2, Dst: 192.168.21.128
User Datagram Protocol, Src Port: 53, Dst Port: 33009
    Source Port: 53
    Destination Port: 33009
    Length: 173
    Checksum: 0xc345 [unverified]
    [Checksum Status: Unverified]
    [Stream index: 2]
    [Timestamps]
Domain Name System (response)

No.     Time           Source                Destination           Protocol Length Info
      8 0.056952208    34.120.208.123        192.168.21.128        TCP      60     443 → 32872 [SYN, ACK] Seq=0 Ack=1 Win=64240 Len=0 MSS=1460

Frame 8: 60 bytes on wire (480 bits), 60 bytes captured (480 bits) on interface eth0, id 0
Ethernet II, Src: VMware_fb:0a:68 (00:50:56:fb:0a:68), Dst: VMware_8e:ef:60 (00:0c:29:8e:ef:60)
Internet Protocol Version 4, Src: 34.120.208.123, Dst: 192.168.21.128
Transmission Control Protocol, Src Port: 443, Dst Port: 32872, Seq: 0, Ack: 1, Len: 0
    Source Port: 443
    Destination Port: 32872
    [Stream index: 0]
    [TCP Segment Len: 0]
    Sequence number: 0    (relative sequence number)
    Sequence number (raw): 888495060
    [Next sequence number: 1    (relative sequence number)]
    Acknowledgment number: 1    (relative ack number)
    Acknowledgment number (raw): 295111982
    0110 .... = Header Length: 24 bytes (6)
    Flags: 0x012 (SYN, ACK)
    Window size value: 64240
    [Calculated window size: 64240]
    Checksum: 0xa257 [unverified]
    [Checksum Status: Unverified]
    Urgent pointer: 0
    Options: (4 bytes), Maximum segment size
    [SEQ/ACK analysis]
        [This is an ACK to the segment in frame: 6]
        [The RTT to ACK the segment was: 0.032177786 seconds]
        [iRTT: 0.032211853 seconds]
    [Timestamps]

No.     Time           Source                Destination           Protocol Length Info
      9 0.056986275    192.168.21.128        34.120.208.123        TCP      54     32872 → 443 [ACK] Seq=1 Ack=1 Win=64240 Len=0

Frame 9: 54 bytes on wire (432 bits), 54 bytes captured (432 bits) on interface eth0, id 0
Ethernet II, Src: VMware_8e:ef:60 (00:0c:29:8e:ef:60), Dst: VMware_fb:0a:68 (00:50:56:fb:0a:68)
Internet Protocol Version 4, Src: 192.168.21.128, Dst: 34.120.208.123
Transmission Control Protocol, Src Port: 32872, Dst Port: 443, Seq: 1, Ack: 1, Len: 0
    Source Port: 32872
    Destination Port: 443
    [Stream index: 0]
    [TCP Segment Len: 0]
    Sequence number: 1    (relative sequence number)
    Sequence number (raw): 295111982
    [Next sequence number: 1    (relative sequence number)]
    Acknowledgment number: 1    (relative ack number)
    Acknowledgment number (raw): 888495061
    0101 .... = Header Length: 20 bytes (5)
    Flags: 0x010 (ACK)
    Window size value: 64240
    [Calculated window size: 64240]
    [Window size scaling factor: -2 (no window scaling used)]
    Checksum: 0xc936 [unverified]
    [Checksum Status: Unverified]
    Urgent pointer: 0
    [SEQ/ACK analysis]
        [This is an ACK to the segment in frame: 8]
        [The RTT to ACK the segment was: 0.000034067 seconds]
        [iRTT: 0.032211853 seconds]
    [Timestamps]

No.     Time           Source                Destination           Protocol Length Info
     10 0.058785385    192.168.21.128        34.120.208.123        TLSv1.3  571    Client Hello

Frame 10: 571 bytes on wire (4568 bits), 571 bytes captured (4568 bits) on interface eth0, id 0
Ethernet II, Src: VMware_8e:ef:60 (00:0c:29:8e:ef:60), Dst: VMware_fb:0a:68 (00:50:56:fb:0a:68)
Internet Protocol Version 4, Src: 192.168.21.128, Dst: 34.120.208.123
Transmission Control Protocol, Src Port: 32872, Dst Port: 443, Seq: 1, Ack: 1, Len: 517
    Source Port: 32872
    Destination Port: 443
    [Stream index: 0]
    [TCP Segment Len: 517]
    Sequence number: 1    (relative sequence number)
    Sequence number (raw): 295111982
    [Next sequence number: 518    (relative sequence number)]
    Acknowledgment number: 1    (relative ack number)
    Acknowledgment number (raw): 888495061
    0101 .... = Header Length: 20 bytes (5)
    Flags: 0x018 (PSH, ACK)
    Window size value: 64240
    [Calculated window size: 64240]
    [Window size scaling factor: -2 (no window scaling used)]
    Checksum: 0xcb3b [unverified]
    [Checksum Status: Unverified]
    Urgent pointer: 0
    [SEQ/ACK analysis]
        [iRTT: 0.032211853 seconds]
        [Bytes in flight: 517]
        [Bytes sent since last PSH flag: 517]
    [Timestamps]
    TCP payload (517 bytes)
Transport Layer Security

No.     Time           Source                Destination           Protocol Length Info
     11 0.058986234    34.120.208.123        192.168.21.128        TCP      60     443 → 32872 [ACK] Seq=1 Ack=518 Win=64240 Len=0

Frame 11: 60 bytes on wire (480 bits), 60 bytes captured (480 bits) on interface eth0, id 0
Ethernet II, Src: VMware_fb:0a:68 (00:50:56:fb:0a:68), Dst: VMware_8e:ef:60 (00:0c:29:8e:ef:60)
Internet Protocol Version 4, Src: 34.120.208.123, Dst: 192.168.21.128
Transmission Control Protocol, Src Port: 443, Dst Port: 32872, Seq: 1, Ack: 518, Len: 0
    Source Port: 443
    Destination Port: 32872
    [Stream index: 0]
    [TCP Segment Len: 0]
    Sequence number: 1    (relative sequence number)
    Sequence number (raw): 888495061
    [Next sequence number: 1    (relative sequence number)]
    Acknowledgment number: 518    (relative ack number)
    Acknowledgment number (raw): 295112499
    0101 .... = Header Length: 20 bytes (5)
    Flags: 0x010 (ACK)
    Window size value: 64240
    [Calculated window size: 64240]
    [Window size scaling factor: -2 (no window scaling used)]
    Checksum: 0xb80f [unverified]
    [Checksum Status: Unverified]
    Urgent pointer: 0
    [SEQ/ACK analysis]
        [This is an ACK to the segment in frame: 10]
        [The RTT to ACK the segment was: 0.000200849 seconds]
        [iRTT: 0.032211853 seconds]
    [Timestamps]

No.     Time           Source                Destination           Protocol Length Info
     12 0.089995883    34.120.208.123        192.168.21.128        TLSv1.3  3484   Server Hello, Change Cipher Spec, Application Data

Frame 12: 3484 bytes on wire (27872 bits), 3484 bytes captured (27872 bits) on interface eth0, id 0
Ethernet II, Src: VMware_fb:0a:68 (00:50:56:fb:0a:68), Dst: VMware_8e:ef:60 (00:0c:29:8e:ef:60)
Internet Protocol Version 4, Src: 34.120.208.123, Dst: 192.168.21.128
Transmission Control Protocol, Src Port: 443, Dst Port: 32872, Seq: 1, Ack: 518, Len: 3430
    Source Port: 443
    Destination Port: 32872
    [Stream index: 0]
    [TCP Segment Len: 3430]
    Sequence number: 1    (relative sequence number)
    Sequence number (raw): 888495061
    [Next sequence number: 3431    (relative sequence number)]
    Acknowledgment number: 518    (relative ack number)
    Acknowledgment number (raw): 295112499
    0101 .... = Header Length: 20 bytes (5)
    Flags: 0x018 (PSH, ACK)
    Window size value: 64240
    [Calculated window size: 64240]
    [Window size scaling factor: -2 (no window scaling used)]
    Checksum: 0xd69c [unverified]
    [Checksum Status: Unverified]
    Urgent pointer: 0
    [SEQ/ACK analysis]
        [iRTT: 0.032211853 seconds]
        [Bytes in flight: 3430]
        [Bytes sent since last PSH flag: 3430]
    [Timestamps]
    TCP payload (3430 bytes)
Transport Layer Security

No.     Time           Source                Destination           Protocol Length Info
     13 0.090022852    192.168.21.128        34.120.208.123        TCP      54     32872 → 443 [ACK] Seq=518 Ack=3431 Win=61320 Len=0

Frame 13: 54 bytes on wire (432 bits), 54 bytes captured (432 bits) on interface eth0, id 0
Ethernet II, Src: VMware_8e:ef:60 (00:0c:29:8e:ef:60), Dst: VMware_fb:0a:68 (00:50:56:fb:0a:68)
Internet Protocol Version 4, Src: 192.168.21.128, Dst: 34.120.208.123
Transmission Control Protocol, Src Port: 32872, Dst Port: 443, Seq: 518, Ack: 3431, Len: 0
    Source Port: 32872
    Destination Port: 443
    [Stream index: 0]
    [TCP Segment Len: 0]
    Sequence number: 518    (relative sequence number)
    Sequence number (raw): 295112499
    [Next sequence number: 518    (relative sequence number)]
    Acknowledgment number: 3431    (relative ack number)
    Acknowledgment number (raw): 888498491
    0101 .... = Header Length: 20 bytes (5)
    Flags: 0x010 (ACK)
    Window size value: 61320
    [Calculated window size: 61320]
    [Window size scaling factor: -2 (no window scaling used)]
    Checksum: 0xc936 [unverified]
    [Checksum Status: Unverified]
    Urgent pointer: 0
    [SEQ/ACK analysis]
        [This is an ACK to the segment in frame: 12]
        [The RTT to ACK the segment was: 0.000026969 seconds]
        [iRTT: 0.032211853 seconds]
    [Timestamps]

No.     Time           Source                Destination           Protocol Length Info
     14 0.095102680    192.168.21.128        34.120.208.123        TLSv1.3  118    Change Cipher Spec, Application Data

Frame 14: 118 bytes on wire (944 bits), 118 bytes captured (944 bits) on interface eth0, id 0
Ethernet II, Src: VMware_8e:ef:60 (00:0c:29:8e:ef:60), Dst: VMware_fb:0a:68 (00:50:56:fb:0a:68)
Internet Protocol Version 4, Src: 192.168.21.128, Dst: 34.120.208.123
Transmission Control Protocol, Src Port: 32872, Dst Port: 443, Seq: 518, Ack: 3431, Len: 64
    Source Port: 32872
    Destination Port: 443
    [Stream index: 0]
    [TCP Segment Len: 64]
    Sequence number: 518    (relative sequence number)
    Sequence number (raw): 295112499
    [Next sequence number: 582    (relative sequence number)]
    Acknowledgment number: 3431    (relative ack number)
    Acknowledgment number (raw): 888498491
    0101 .... = Header Length: 20 bytes (5)
    Flags: 0x018 (PSH, ACK)
    Window size value: 62780
    [Calculated window size: 62780]
    [Window size scaling factor: -2 (no window scaling used)]
    Checksum: 0xc976 [unverified]
    [Checksum Status: Unverified]
    Urgent pointer: 0
    [SEQ/ACK analysis]
        [iRTT: 0.032211853 seconds]
        [Bytes in flight: 64]
        [Bytes sent since last PSH flag: 64]
    [Timestamps]
    TCP payload (64 bytes)
Transport Layer Security

No.     Time           Source                Destination           Protocol Length Info
     15 0.095255385    34.120.208.123        192.168.21.128        TCP      60     443 → 32872 [ACK] Seq=3431 Ack=582 Win=64240 Len=0

Frame 15: 60 bytes on wire (480 bits), 60 bytes captured (480 bits) on interface eth0, id 0
Ethernet II, Src: VMware_fb:0a:68 (00:50:56:fb:0a:68), Dst: VMware_8e:ef:60 (00:0c:29:8e:ef:60)
Internet Protocol Version 4, Src: 34.120.208.123, Dst: 192.168.21.128
Transmission Control Protocol, Src Port: 443, Dst Port: 32872, Seq: 3431, Ack: 582, Len: 0
    Source Port: 443
    Destination Port: 32872
    [Stream index: 0]
    [TCP Segment Len: 0]
    Sequence number: 3431    (relative sequence number)
    Sequence number (raw): 888498491
    [Next sequence number: 3431    (relative sequence number)]
    Acknowledgment number: 582    (relative ack number)
    Acknowledgment number (raw): 295112563
    0101 .... = Header Length: 20 bytes (5)
    Flags: 0x010 (ACK)
    Window size value: 64240
    [Calculated window size: 64240]
    [Window size scaling factor: -2 (no window scaling used)]
    Checksum: 0xaa69 [unverified]
    [Checksum Status: Unverified]
    Urgent pointer: 0
    [SEQ/ACK analysis]
        [This is an ACK to the segment in frame: 14]
        [The RTT to ACK the segment was: 0.000152705 seconds]
        [iRTT: 0.032211853 seconds]
    [Timestamps]

No.     Time           Source                Destination           Protocol Length Info
     16 0.114384685    192.168.21.128        34.120.208.123        TLSv1.3  224    Application Data

Frame 16: 224 bytes on wire (1792 bits), 224 bytes captured (1792 bits) on interface eth0, id 0
Ethernet II, Src: VMware_8e:ef:60 (00:0c:29:8e:ef:60), Dst: VMware_fb:0a:68 (00:50:56:fb:0a:68)
Internet Protocol Version 4, Src: 192.168.21.128, Dst: 34.120.208.123
Transmission Control Protocol, Src Port: 32872, Dst Port: 443, Seq: 582, Ack: 3431, Len: 170
    Source Port: 32872
    Destination Port: 443
    [Stream index: 0]
    [TCP Segment Len: 170]
    Sequence number: 582    (relative sequence number)
    Sequence number (raw): 295112563
    [Next sequence number: 752    (relative sequence number)]
    Acknowledgment number: 3431    (relative ack number)
    Acknowledgment number (raw): 888498491
    0101 .... = Header Length: 20 bytes (5)
    Flags: 0x018 (PSH, ACK)
    Window size value: 62780
    [Calculated window size: 62780]
    [Window size scaling factor: -2 (no window scaling used)]
    Checksum: 0xc9e0 [unverified]
    [Checksum Status: Unverified]
    Urgent pointer: 0
    [SEQ/ACK analysis]
        [iRTT: 0.032211853 seconds]
        [Bytes in flight: 170]
        [Bytes sent since last PSH flag: 170]
    [Timestamps]
    TCP payload (170 bytes)
Transport Layer Security

No.     Time           Source                Destination           Protocol Length Info
     17 0.114458057    192.168.21.128        34.120.208.123        TLSv1.3  417    Application Data

Frame 17: 417 bytes on wire (3336 bits), 417 bytes captured (3336 bits) on interface eth0, id 0
Ethernet II, Src: VMware_8e:ef:60 (00:0c:29:8e:ef:60), Dst: VMware_fb:0a:68 (00:50:56:fb:0a:68)
Internet Protocol Version 4, Src: 192.168.21.128, Dst: 34.120.208.123
Transmission Control Protocol, Src Port: 32872, Dst Port: 443, Seq: 752, Ack: 3431, Len: 363
    Source Port: 32872
    Destination Port: 443
    [Stream index: 0]
    [TCP Segment Len: 363]
    Sequence number: 752    (relative sequence number)
    Sequence number (raw): 295112733
    [Next sequence number: 1115    (relative sequence number)]
    Acknowledgment number: 3431    (relative ack number)
    Acknowledgment number (raw): 888498491
    0101 .... = Header Length: 20 bytes (5)
    Flags: 0x018 (PSH, ACK)
    Window size value: 62780
    [Calculated window size: 62780]
    [Window size scaling factor: -2 (no window scaling used)]
    Checksum: 0xcaa1 [unverified]
    [Checksum Status: Unverified]
    Urgent pointer: 0
    [SEQ/ACK analysis]
        [iRTT: 0.032211853 seconds]
        [Bytes in flight: 533]
        [Bytes sent since last PSH flag: 363]
    [Timestamps]
    TCP payload (363 bytes)
Transport Layer Security

No.     Time           Source                Destination           Protocol Length Info
     18 0.114525368    192.168.21.128        34.120.208.123        TLSv1.3  476    Application Data

Frame 18: 476 bytes on wire (3808 bits), 476 bytes captured (3808 bits) on interface eth0, id 0
Ethernet II, Src: VMware_8e:ef:60 (00:0c:29:8e:ef:60), Dst: VMware_fb:0a:68 (00:50:56:fb:0a:68)
Internet Protocol Version 4, Src: 192.168.21.128, Dst: 34.120.208.123
Transmission Control Protocol, Src Port: 32872, Dst Port: 443, Seq: 1115, Ack: 3431, Len: 422
    Source Port: 32872
    Destination Port: 443
    [Stream index: 0]
    [TCP Segment Len: 422]
    Sequence number: 1115    (relative sequence number)
    Sequence number (raw): 295113096
    [Next sequence number: 1537    (relative sequence number)]
    Acknowledgment number: 3431    (relative ack number)
    Acknowledgment number (raw): 888498491
    0101 .... = Header Length: 20 bytes (5)
    Flags: 0x018 (PSH, ACK)
    Window size value: 62780
    [Calculated window size: 62780]
    [Window size scaling factor: -2 (no window scaling used)]
    Checksum: 0xcadc [unverified]
    [Checksum Status: Unverified]
    Urgent pointer: 0
    [SEQ/ACK analysis]
        [iRTT: 0.032211853 seconds]
        [Bytes in flight: 955]
        [Bytes sent since last PSH flag: 422]
    [Timestamps]
    TCP payload (422 bytes)
Transport Layer Security

No.     Time           Source                Destination           Protocol Length Info
     19 0.114579319    34.120.208.123        192.168.21.128        TCP      60     443 → 32872 [ACK] Seq=3431 Ack=752 Win=64240 Len=0

Frame 19: 60 bytes on wire (480 bits), 60 bytes captured (480 bits) on interface eth0, id 0
Ethernet II, Src: VMware_fb:0a:68 (00:50:56:fb:0a:68), Dst: VMware_8e:ef:60 (00:0c:29:8e:ef:60)
Internet Protocol Version 4, Src: 34.120.208.123, Dst: 192.168.21.128
Transmission Control Protocol, Src Port: 443, Dst Port: 32872, Seq: 3431, Ack: 752, Len: 0
    Source Port: 443
    Destination Port: 32872
    [Stream index: 0]
    [TCP Segment Len: 0]
    Sequence number: 3431    (relative sequence number)
    Sequence number (raw): 888498491
    [Next sequence number: 3431    (relative sequence number)]
    Acknowledgment number: 752    (relative ack number)
    Acknowledgment number (raw): 295112733
    0101 .... = Header Length: 20 bytes (5)
    Flags: 0x010 (ACK)
    Window size value: 64240
    [Calculated window size: 64240]
    [Window size scaling factor: -2 (no window scaling used)]
    Checksum: 0xa9bf [unverified]
    [Checksum Status: Unverified]
    Urgent pointer: 0
    [SEQ/ACK analysis]
        [This is an ACK to the segment in frame: 16]
        [The RTT to ACK the segment was: 0.000194634 seconds]
        [iRTT: 0.032211853 seconds]
    [Timestamps]

No.     Time           Source                Destination           Protocol Length Info
     20 0.114579401    34.120.208.123        192.168.21.128        TCP      60     443 → 32872 [ACK] Seq=3431 Ack=1115 Win=64240 Len=0

Frame 20: 60 bytes on wire (480 bits), 60 bytes captured (480 bits) on interface eth0, id 0
Ethernet II, Src: VMware_fb:0a:68 (00:50:56:fb:0a:68), Dst: VMware_8e:ef:60 (00:0c:29:8e:ef:60)
Internet Protocol Version 4, Src: 34.120.208.123, Dst: 192.168.21.128
Transmission Control Protocol, Src Port: 443, Dst Port: 32872, Seq: 3431, Ack: 1115, Len: 0
    Source Port: 443
    Destination Port: 32872
    [Stream index: 0]
    [TCP Segment Len: 0]
    Sequence number: 3431    (relative sequence number)
    Sequence number (raw): 888498491
    [Next sequence number: 3431    (relative sequence number)]
    Acknowledgment number: 1115    (relative ack number)
    Acknowledgment number (raw): 295113096
    0101 .... = Header Length: 20 bytes (5)
    Flags: 0x010 (ACK)
    Window size value: 64240
    [Calculated window size: 64240]
    [Window size scaling factor: -2 (no window scaling used)]
    Checksum: 0xa854 [unverified]
    [Checksum Status: Unverified]
    Urgent pointer: 0
    [SEQ/ACK analysis]
        [This is an ACK to the segment in frame: 17]
        [The RTT to ACK the segment was: 0.000121344 seconds]
        [iRTT: 0.032211853 seconds]
    [Timestamps]

No.     Time           Source                Destination           Protocol Length Info
     21 0.114636963    34.120.208.123        192.168.21.128        TCP      60     443 → 32872 [ACK] Seq=3431 Ack=1537 Win=64240 Len=0

Frame 21: 60 bytes on wire (480 bits), 60 bytes captured (480 bits) on interface eth0, id 0
Ethernet II, Src: VMware_fb:0a:68 (00:50:56:fb:0a:68), Dst: VMware_8e:ef:60 (00:0c:29:8e:ef:60)
Internet Protocol Version 4, Src: 34.120.208.123, Dst: 192.168.21.128
Transmission Control Protocol, Src Port: 443, Dst Port: 32872, Seq: 3431, Ack: 1537, Len: 0
    Source Port: 443
    Destination Port: 32872
    [Stream index: 0]
    [TCP Segment Len: 0]
    Sequence number: 3431    (relative sequence number)
    Sequence number (raw): 888498491
    [Next sequence number: 3431    (relative sequence number)]
    Acknowledgment number: 1537    (relative ack number)
    Acknowledgment number (raw): 295113518
    0101 .... = Header Length: 20 bytes (5)
    Flags: 0x010 (ACK)
    Window size value: 64240
    [Calculated window size: 64240]
    [Window size scaling factor: -2 (no window scaling used)]
    Checksum: 0xa6ae [unverified]
    [Checksum Status: Unverified]
    Urgent pointer: 0
    [SEQ/ACK analysis]
        [This is an ACK to the segment in frame: 18]
        [The RTT to ACK the segment was: 0.000111595 seconds]
        [iRTT: 0.032211853 seconds]
    [Timestamps]

No.     Time           Source                Destination           Protocol Length Info
     22 0.116459833    192.168.21.128        192.168.21.2          DNS      86     Standard query 0x0c53 A i4prj.ase.au.dk OPT

Frame 22: 86 bytes on wire (688 bits), 86 bytes captured (688 bits) on interface eth0, id 0
Ethernet II, Src: VMware_8e:ef:60 (00:0c:29:8e:ef:60), Dst: VMware_fb:0a:68 (00:50:56:fb:0a:68)
Internet Protocol Version 4, Src: 192.168.21.128, Dst: 192.168.21.2
User Datagram Protocol, Src Port: 54614, Dst Port: 53
    Source Port: 54614
    Destination Port: 53
    Length: 52
    Checksum: 0xac18 [unverified]
    [Checksum Status: Unverified]
    [Stream index: 3]
    [Timestamps]
Domain Name System (query)

No.     Time           Source                Destination           Protocol Length Info
     23 0.137952286    192.168.21.2          192.168.21.128        DNS      102    Standard query response 0x0c53 A i4prj.ase.au.dk A 10.29.0.30 OPT

Frame 23: 102 bytes on wire (816 bits), 102 bytes captured (816 bits) on interface eth0, id 0
Ethernet II, Src: VMware_fb:0a:68 (00:50:56:fb:0a:68), Dst: VMware_8e:ef:60 (00:0c:29:8e:ef:60)
Internet Protocol Version 4, Src: 192.168.21.2, Dst: 192.168.21.128
User Datagram Protocol, Src Port: 53, Dst Port: 54614
    Source Port: 53
    Destination Port: 54614
    Length: 68
    Checksum: 0x8c5f [unverified]
    [Checksum Status: Unverified]
    [Stream index: 3]
    [Timestamps]
Domain Name System (response)

No.     Time           Source                Destination           Protocol Length Info
     24 0.149399971    34.120.208.123        192.168.21.128        TLSv1.3  634    Application Data, Application Data

Frame 24: 634 bytes on wire (5072 bits), 634 bytes captured (5072 bits) on interface eth0, id 0
Ethernet II, Src: VMware_fb:0a:68 (00:50:56:fb:0a:68), Dst: VMware_8e:ef:60 (00:0c:29:8e:ef:60)
Internet Protocol Version 4, Src: 34.120.208.123, Dst: 192.168.21.128
Transmission Control Protocol, Src Port: 443, Dst Port: 32872, Seq: 3431, Ack: 1537, Len: 580
    Source Port: 443
    Destination Port: 32872
    [Stream index: 0]
    [TCP Segment Len: 580]
    Sequence number: 3431    (relative sequence number)
    Sequence number (raw): 888498491
    [Next sequence number: 4011    (relative sequence number)]
    Acknowledgment number: 1537    (relative ack number)
    Acknowledgment number (raw): 295113518
    0101 .... = Header Length: 20 bytes (5)
    Flags: 0x018 (PSH, ACK)
    Window size value: 64240
    [Calculated window size: 64240]
    [Window size scaling factor: -2 (no window scaling used)]
    Checksum: 0x93df [unverified]
    [Checksum Status: Unverified]
    Urgent pointer: 0
    [SEQ/ACK analysis]
        [iRTT: 0.032211853 seconds]
        [Bytes in flight: 580]
        [Bytes sent since last PSH flag: 580]
    [Timestamps]
    TCP payload (580 bytes)
Transport Layer Security

No.     Time           Source                Destination           Protocol Length Info
     25 0.149414322    192.168.21.128        34.120.208.123        TCP      54     32872 → 443 [ACK] Seq=1537 Ack=4011 Win=62780 Len=0

Frame 25: 54 bytes on wire (432 bits), 54 bytes captured (432 bits) on interface eth0, id 0
Ethernet II, Src: VMware_8e:ef:60 (00:0c:29:8e:ef:60), Dst: VMware_fb:0a:68 (00:50:56:fb:0a:68)
Internet Protocol Version 4, Src: 192.168.21.128, Dst: 34.120.208.123
Transmission Control Protocol, Src Port: 32872, Dst Port: 443, Seq: 1537, Ack: 4011, Len: 0
    Source Port: 32872
    Destination Port: 443
    [Stream index: 0]
    [TCP Segment Len: 0]
    Sequence number: 1537    (relative sequence number)
    Sequence number (raw): 295113518
    [Next sequence number: 1537    (relative sequence number)]
    Acknowledgment number: 4011    (relative ack number)
    Acknowledgment number (raw): 888499071
    0101 .... = Header Length: 20 bytes (5)
    Flags: 0x010 (ACK)
    Window size value: 62780
    [Calculated window size: 62780]
    [Window size scaling factor: -2 (no window scaling used)]
    Checksum: 0xc936 [unverified]
    [Checksum Status: Unverified]
    Urgent pointer: 0
    [SEQ/ACK analysis]
        [This is an ACK to the segment in frame: 24]
        [The RTT to ACK the segment was: 0.000014351 seconds]
        [iRTT: 0.032211853 seconds]
    [Timestamps]

No.     Time           Source                Destination           Protocol Length Info
     26 0.149845248    192.168.21.128        34.120.208.123        TLSv1.3  85     Application Data

Frame 26: 85 bytes on wire (680 bits), 85 bytes captured (680 bits) on interface eth0, id 0
Ethernet II, Src: VMware_8e:ef:60 (00:0c:29:8e:ef:60), Dst: VMware_fb:0a:68 (00:50:56:fb:0a:68)
Internet Protocol Version 4, Src: 192.168.21.128, Dst: 34.120.208.123
Transmission Control Protocol, Src Port: 32872, Dst Port: 443, Seq: 1537, Ack: 4011, Len: 31
    Source Port: 32872
    Destination Port: 443
    [Stream index: 0]
    [TCP Segment Len: 31]
    Sequence number: 1537    (relative sequence number)
    Sequence number (raw): 295113518
    [Next sequence number: 1568    (relative sequence number)]
    Acknowledgment number: 4011    (relative ack number)
    Acknowledgment number (raw): 888499071
    0101 .... = Header Length: 20 bytes (5)
    Flags: 0x018 (PSH, ACK)
    Window size value: 62780
    [Calculated window size: 62780]
    [Window size scaling factor: -2 (no window scaling used)]
    Checksum: 0xc955 [unverified]
    [Checksum Status: Unverified]
    Urgent pointer: 0
    [SEQ/ACK analysis]
        [iRTT: 0.032211853 seconds]
        [Bytes in flight: 31]
        [Bytes sent since last PSH flag: 31]
    [Timestamps]
    TCP payload (31 bytes)
Transport Layer Security

No.     Time           Source                Destination           Protocol Length Info
     27 0.149948318    34.120.208.123        192.168.21.128        TCP      60     443 → 32872 [ACK] Seq=4011 Ack=1568 Win=64240 Len=0

Frame 27: 60 bytes on wire (480 bits), 60 bytes captured (480 bits) on interface eth0, id 0
Ethernet II, Src: VMware_fb:0a:68 (00:50:56:fb:0a:68), Dst: VMware_8e:ef:60 (00:0c:29:8e:ef:60)
Internet Protocol Version 4, Src: 34.120.208.123, Dst: 192.168.21.128
Transmission Control Protocol, Src Port: 443, Dst Port: 32872, Seq: 4011, Ack: 1568, Len: 0
    Source Port: 443
    Destination Port: 32872
    [Stream index: 0]
    [TCP Segment Len: 0]
    Sequence number: 4011    (relative sequence number)
    Sequence number (raw): 888499071
    [Next sequence number: 4011    (relative sequence number)]
    Acknowledgment number: 1568    (relative ack number)
    Acknowledgment number (raw): 295113549
    0101 .... = Header Length: 20 bytes (5)
    Flags: 0x010 (ACK)
    Window size value: 64240
    [Calculated window size: 64240]
    [Window size scaling factor: -2 (no window scaling used)]
    Checksum: 0xa44b [unverified]
    [Checksum Status: Unverified]
    Urgent pointer: 0
    [SEQ/ACK analysis]
        [This is an ACK to the segment in frame: 26]
        [The RTT to ACK the segment was: 0.000103070 seconds]
        [iRTT: 0.032211853 seconds]
    [Timestamps]

No.     Time           Source                Destination           Protocol Length Info
     28 0.179448274    34.120.208.123        192.168.21.128        TLSv1.3  85     Application Data

Frame 28: 85 bytes on wire (680 bits), 85 bytes captured (680 bits) on interface eth0, id 0
Ethernet II, Src: VMware_fb:0a:68 (00:50:56:fb:0a:68), Dst: VMware_8e:ef:60 (00:0c:29:8e:ef:60)
Internet Protocol Version 4, Src: 34.120.208.123, Dst: 192.168.21.128
Transmission Control Protocol, Src Port: 443, Dst Port: 32872, Seq: 4011, Ack: 1568, Len: 31
    Source Port: 443
    Destination Port: 32872
    [Stream index: 0]
    [TCP Segment Len: 31]
    Sequence number: 4011    (relative sequence number)
    Sequence number (raw): 888499071
    [Next sequence number: 4042    (relative sequence number)]
    Acknowledgment number: 1568    (relative ack number)
    Acknowledgment number (raw): 295113549
    0101 .... = Header Length: 20 bytes (5)
    Flags: 0x018 (PSH, ACK)
    Window size value: 64240
    [Calculated window size: 64240]
    [Window size scaling factor: -2 (no window scaling used)]
    Checksum: 0x489b [unverified]
    [Checksum Status: Unverified]
    Urgent pointer: 0
    [SEQ/ACK analysis]
        [iRTT: 0.032211853 seconds]
        [Bytes in flight: 31]
        [Bytes sent since last PSH flag: 31]
    [Timestamps]
    TCP payload (31 bytes)
Transport Layer Security

No.     Time           Source                Destination           Protocol Length Info
     29 0.179478040    192.168.21.128        34.120.208.123        TCP      54     32872 → 443 [ACK] Seq=1568 Ack=4042 Win=62780 Len=0

Frame 29: 54 bytes on wire (432 bits), 54 bytes captured (432 bits) on interface eth0, id 0
Ethernet II, Src: VMware_8e:ef:60 (00:0c:29:8e:ef:60), Dst: VMware_fb:0a:68 (00:50:56:fb:0a:68)
Internet Protocol Version 4, Src: 192.168.21.128, Dst: 34.120.208.123
Transmission Control Protocol, Src Port: 32872, Dst Port: 443, Seq: 1568, Ack: 4042, Len: 0
    Source Port: 32872
    Destination Port: 443
    [Stream index: 0]
    [TCP Segment Len: 0]
    Sequence number: 1568    (relative sequence number)
    Sequence number (raw): 295113549
    [Next sequence number: 1568    (relative sequence number)]
    Acknowledgment number: 4042    (relative ack number)
    Acknowledgment number (raw): 888499102
    0101 .... = Header Length: 20 bytes (5)
    Flags: 0x010 (ACK)
    Window size value: 62780
    [Calculated window size: 62780]
    [Window size scaling factor: -2 (no window scaling used)]
    Checksum: 0xc936 [unverified]
    [Checksum Status: Unverified]
    Urgent pointer: 0
    [SEQ/ACK analysis]
        [This is an ACK to the segment in frame: 28]
        [The RTT to ACK the segment was: 0.000029766 seconds]
        [iRTT: 0.032211853 seconds]
    [Timestamps]

No.     Time           Source                Destination           Protocol Length Info
     30 0.388606708    34.120.208.123        192.168.21.128        TLSv1.3  505    Application Data

Frame 30: 505 bytes on wire (4040 bits), 505 bytes captured (4040 bits) on interface eth0, id 0
Ethernet II, Src: VMware_fb:0a:68 (00:50:56:fb:0a:68), Dst: VMware_8e:ef:60 (00:0c:29:8e:ef:60)
Internet Protocol Version 4, Src: 34.120.208.123, Dst: 192.168.21.128
Transmission Control Protocol, Src Port: 443, Dst Port: 32872, Seq: 4042, Ack: 1568, Len: 451
    Source Port: 443
    Destination Port: 32872
    [Stream index: 0]
    [TCP Segment Len: 451]
    Sequence number: 4042    (relative sequence number)
    Sequence number (raw): 888499102
    [Next sequence number: 4493    (relative sequence number)]
    Acknowledgment number: 1568    (relative ack number)
    Acknowledgment number (raw): 295113549
    0101 .... = Header Length: 20 bytes (5)
    Flags: 0x018 (PSH, ACK)
    Window size value: 64240
    [Calculated window size: 64240]
    [Window size scaling factor: -2 (no window scaling used)]
    Checksum: 0x8ae9 [unverified]
    [Checksum Status: Unverified]
    Urgent pointer: 0
    [SEQ/ACK analysis]
        [iRTT: 0.032211853 seconds]
        [Bytes in flight: 451]
        [Bytes sent since last PSH flag: 451]
    [Timestamps]
    TCP payload (451 bytes)
Transport Layer Security

No.     Time           Source                Destination           Protocol Length Info
     31 0.388628945    192.168.21.128        34.120.208.123        TCP      54     32872 → 443 [ACK] Seq=1568 Ack=4493 Win=62780 Len=0

Frame 31: 54 bytes on wire (432 bits), 54 bytes captured (432 bits) on interface eth0, id 0
Ethernet II, Src: VMware_8e:ef:60 (00:0c:29:8e:ef:60), Dst: VMware_fb:0a:68 (00:50:56:fb:0a:68)
Internet Protocol Version 4, Src: 192.168.21.128, Dst: 34.120.208.123
Transmission Control Protocol, Src Port: 32872, Dst Port: 443, Seq: 1568, Ack: 4493, Len: 0
    Source Port: 32872
    Destination Port: 443
    [Stream index: 0]
    [TCP Segment Len: 0]
    Sequence number: 1568    (relative sequence number)
    Sequence number (raw): 295113549
    [Next sequence number: 1568    (relative sequence number)]
    Acknowledgment number: 4493    (relative ack number)
    Acknowledgment number (raw): 888499553
    0101 .... = Header Length: 20 bytes (5)
    Flags: 0x010 (ACK)
    Window size value: 62780
    [Calculated window size: 62780]
    [Window size scaling factor: -2 (no window scaling used)]
    Checksum: 0xc936 [unverified]
    [Checksum Status: Unverified]
    Urgent pointer: 0
    [SEQ/ACK analysis]
        [This is an ACK to the segment in frame: 30]
        [The RTT to ACK the segment was: 0.000022237 seconds]
        [iRTT: 0.032211853 seconds]
    [Timestamps]

No.     Time           Source                Destination           Protocol Length Info
     32 0.388944530    192.168.21.128        34.120.208.123        TLSv1.3  93     Application Data

Frame 32: 93 bytes on wire (744 bits), 93 bytes captured (744 bits) on interface eth0, id 0
Ethernet II, Src: VMware_8e:ef:60 (00:0c:29:8e:ef:60), Dst: VMware_fb:0a:68 (00:50:56:fb:0a:68)
Internet Protocol Version 4, Src: 192.168.21.128, Dst: 34.120.208.123
Transmission Control Protocol, Src Port: 32872, Dst Port: 443, Seq: 1568, Ack: 4493, Len: 39
    Source Port: 32872
    Destination Port: 443
    [Stream index: 0]
    [TCP Segment Len: 39]
    Sequence number: 1568    (relative sequence number)
    Sequence number (raw): 295113549
    [Next sequence number: 1607    (relative sequence number)]
    Acknowledgment number: 4493    (relative ack number)
    Acknowledgment number (raw): 888499553
    0101 .... = Header Length: 20 bytes (5)
    Flags: 0x018 (PSH, ACK)
    Window size value: 62780
    [Calculated window size: 62780]
    [Window size scaling factor: -2 (no window scaling used)]
    Checksum: 0xc95d [unverified]
    [Checksum Status: Unverified]
    Urgent pointer: 0
    [SEQ/ACK analysis]
        [iRTT: 0.032211853 seconds]
        [Bytes in flight: 39]
        [Bytes sent since last PSH flag: 39]
    [Timestamps]
    TCP payload (39 bytes)
Transport Layer Security

No.     Time           Source                Destination           Protocol Length Info
     33 0.389138112    34.120.208.123        192.168.21.128        TCP      60     443 → 32872 [ACK] Seq=4493 Ack=1607 Win=64240 Len=0

Frame 33: 60 bytes on wire (480 bits), 60 bytes captured (480 bits) on interface eth0, id 0
