No.     Time           Source                Destination           Protocol Length Info
      6 0.024774422    192.168.21.128        34.120.208.123        TCP      74     32872 → 443 [SYN] Seq=0 Win=64240 Len=0 MSS=1460 SACK_PERM=1 TSval=3548506638 TSecr=0 WS=128

Frame 6: 74 bytes on wire (592 bits), 74 bytes captured (592 bits) on interface eth0, id 0
Ethernet II, Src: VMware_8e:ef:60 (00:0c:29:8e:ef:60), Dst: VMware_fb:0a:68 (00:50:56:fb:0a:68)
Internet Protocol Version 4, Src: 192.168.21.128, Dst: 34.120.208.123
Transmission Control Protocol, Src Port: 32872, Dst Port: 443, Seq: 0, Len: 0
    Source Port: 32872
    Destination Port: 443
    [Stream index: 0]
    [TCP Segment Len: 0]
    Sequence number: 0    (relative sequence number)
    Sequence number (raw): 295111981
    [Next sequence number: 1    (relative sequence number)]
    Acknowledgment number: 0
    Acknowledgment number (raw): 0
    1010 .... = Header Length: 40 bytes (10)
    Flags: 0x002 (SYN)
    Window size value: 64240
    [Calculated window size: 64240]
    Checksum: 0xc94a [unverified]
    [Checksum Status: Unverified]
    Urgent pointer: 0
    Options: (20 bytes), Maximum segment size, SACK permitted, Timestamps, No-Operation (NOP), Window scale
    [Timestamps]

No.     Time           Source                Destination           Protocol Length Info
      8 0.056952208    34.120.208.123        192.168.21.128        TCP      60     443 → 32872 [SYN, ACK] Seq=0 Ack=1 Win=64240 Len=0 MSS=1460

Frame 8: 60 bytes on wire (480 bits), 60 bytes captured (480 bits) on interface eth0, id 0
Ethernet II, Src: VMware_fb:0a:68 (00:50:56:fb:0a:68), Dst: VMware_8e:ef:60 (00:0c:29:8e:ef:60)
Internet Protocol Version 4, Src: 34.120.208.123, Dst: 192.168.21.128
Transmission Control Protocol, Src Port: 443, Dst Port: 32872, Seq: 0, Ack: 1, Len: 0
    Source Port: 443
    Destination Port: 32872
    [Stream index: 0]
    [TCP Segment Len: 0]
    Sequence number: 0    (relative sequence number)
    Sequence number (raw): 888495060
    [Next sequence number: 1    (relative sequence number)]
    Acknowledgment number: 1    (relative ack number)
    Acknowledgment number (raw): 295111982
    0110 .... = Header Length: 24 bytes (6)
    Flags: 0x012 (SYN, ACK)
    Window size value: 64240
    [Calculated window size: 64240]
    Checksum: 0xa257 [unverified]
    [Checksum Status: Unverified]
    Urgent pointer: 0
    Options: (4 bytes), Maximum segment size
    [SEQ/ACK analysis]
        [This is an ACK to the segment in frame: 6]
        [The RTT to ACK the segment was: 0.032177786 seconds]
        [iRTT: 0.032211853 seconds]
    [Timestamps]

No.     Time           Source                Destination           Protocol Length Info
      9 0.056986275    192.168.21.128        34.120.208.123        TCP      54     32872 → 443 [ACK] Seq=1 Ack=1 Win=64240 Len=0

Frame 9: 54 bytes on wire (432 bits), 54 bytes captured (432 bits) on interface eth0, id 0
Ethernet II, Src: VMware_8e:ef:60 (00:0c:29:8e:ef:60), Dst: VMware_fb:0a:68 (00:50:56:fb:0a:68)
Internet Protocol Version 4, Src: 192.168.21.128, Dst: 34.120.208.123
Transmission Control Protocol, Src Port: 32872, Dst Port: 443, Seq: 1, Ack: 1, Len: 0
    Source Port: 32872
    Destination Port: 443
    [Stream index: 0]
    [TCP Segment Len: 0]
    Sequence number: 1    (relative sequence number)
    Sequence number (raw): 295111982
    [Next sequence number: 1    (relative sequence number)]
    Acknowledgment number: 1    (relative ack number)
    Acknowledgment number (raw): 888495061
    0101 .... = Header Length: 20 bytes (5)
    Flags: 0x010 (ACK)
    Window size value: 64240
    [Calculated window size: 64240]
    [Window size scaling factor: -2 (no window scaling used)]
    Checksum: 0xc936 [unverified]
    [Checksum Status: Unverified]
    Urgent pointer: 0
    [SEQ/ACK analysis]
        [This is an ACK to the segment in frame: 8]
        [The RTT to ACK the segment was: 0.000034067 seconds]
        [iRTT: 0.032211853 seconds]
    [Timestamps]

No.     Time           Source                Destination           Protocol Length Info
     10 0.058785385    192.168.21.128        34.120.208.123        TLSv1.3  571    Client Hello

Frame 10: 571 bytes on wire (4568 bits), 571 bytes captured (4568 bits) on interface eth0, id 0
Ethernet II, Src: VMware_8e:ef:60 (00:0c:29:8e:ef:60), Dst: VMware_fb:0a:68 (00:50:56:fb:0a:68)
Internet Protocol Version 4, Src: 192.168.21.128, Dst: 34.120.208.123
Transmission Control Protocol, Src Port: 32872, Dst Port: 443, Seq: 1, Ack: 1, Len: 517
    Source Port: 32872
    Destination Port: 443
    [Stream index: 0]
    [TCP Segment Len: 517]
    Sequence number: 1    (relative sequence number)
    Sequence number (raw): 295111982
    [Next sequence number: 518    (relative sequence number)]
    Acknowledgment number: 1    (relative ack number)
    Acknowledgment number (raw): 888495061
    0101 .... = Header Length: 20 bytes (5)
    Flags: 0x018 (PSH, ACK)
    Window size value: 64240
    [Calculated window size: 64240]
    [Window size scaling factor: -2 (no window scaling used)]
    Checksum: 0xcb3b [unverified]
    [Checksum Status: Unverified]
    Urgent pointer: 0
    [SEQ/ACK analysis]
        [iRTT: 0.032211853 seconds]
        [Bytes in flight: 517]
        [Bytes sent since last PSH flag: 517]
    [Timestamps]
    TCP payload (517 bytes)
Transport Layer Security
    TLSv1.3 Record Layer: Handshake Protocol: Client Hello
        Content Type: Handshake (22)
        Version: TLS 1.0 (0x0301)
        Length: 512
        Handshake Protocol: Client Hello
            Handshake Type: Client Hello (1)
            Length: 508
            Version: TLS 1.2 (0x0303)
            Random: c4ea065136cfc1e5b1c3b317914969a0b33e8030c9ec5e01…
            Session ID Length: 32
            Session ID: 1e080e5f9564250abb7e3148d9228b2bde1c9ccc9581dfe0…
            Cipher Suites Length: 34
            Cipher Suites (17 suites)
            Compression Methods Length: 1
            Compression Methods (1 method)
            Extensions Length: 401
            Extension: server_name (len=35)
            Extension: extended_master_secret (len=0)
            Extension: renegotiation_info (len=1)
            Extension: supported_groups (len=14)
            Extension: ec_point_formats (len=2)
            Extension: session_ticket (len=0)
            Extension: application_layer_protocol_negotiation (len=14)
            Extension: status_request (len=5)
            Extension: Unknown type 34 (len=10)
            Extension: key_share (len=107)
            Extension: supported_versions (len=5)
            Extension: signature_algorithms (len=24)
            Extension: psk_key_exchange_modes (len=2)
            Extension: record_size_limit (len=2)
            Extension: padding (len=120)

No.     Time           Source                Destination           Protocol Length Info
     11 0.058986234    34.120.208.123        192.168.21.128        TCP      60     443 → 32872 [ACK] Seq=1 Ack=518 Win=64240 Len=0

Frame 11: 60 bytes on wire (480 bits), 60 bytes captured (480 bits) on interface eth0, id 0
Ethernet II, Src: VMware_fb:0a:68 (00:50:56:fb:0a:68), Dst: VMware_8e:ef:60 (00:0c:29:8e:ef:60)
Internet Protocol Version 4, Src: 34.120.208.123, Dst: 192.168.21.128
Transmission Control Protocol, Src Port: 443, Dst Port: 32872, Seq: 1, Ack: 518, Len: 0
    Source Port: 443
    Destination Port: 32872
    [Stream index: 0]
    [TCP Segment Len: 0]
    Sequence number: 1    (relative sequence number)
    Sequence number (raw): 888495061
    [Next sequence number: 1    (relative sequence number)]
    Acknowledgment number: 518    (relative ack number)
    Acknowledgment number (raw): 295112499
    0101 .... = Header Length: 20 bytes (5)
    Flags: 0x010 (ACK)
    Window size value: 64240
    [Calculated window size: 64240]
    [Window size scaling factor: -2 (no window scaling used)]
    Checksum: 0xb80f [unverified]
    [Checksum Status: Unverified]
    Urgent pointer: 0
    [SEQ/ACK analysis]
        [This is an ACK to the segment in frame: 10]
        [The RTT to ACK the segment was: 0.000200849 seconds]
        [iRTT: 0.032211853 seconds]
    [Timestamps]

No.     Time           Source                Destination           Protocol Length Info
     12 0.089995883    34.120.208.123        192.168.21.128        TLSv1.3  3484   Server Hello, Change Cipher Spec, Application Data

Frame 12: 3484 bytes on wire (27872 bits), 3484 bytes captured (27872 bits) on interface eth0, id 0
Ethernet II, Src: VMware_fb:0a:68 (00:50:56:fb:0a:68), Dst: VMware_8e:ef:60 (00:0c:29:8e:ef:60)
Internet Protocol Version 4, Src: 34.120.208.123, Dst: 192.168.21.128
Transmission Control Protocol, Src Port: 443, Dst Port: 32872, Seq: 1, Ack: 518, Len: 3430
    Source Port: 443
    Destination Port: 32872
    [Stream index: 0]
    [TCP Segment Len: 3430]
    Sequence number: 1    (relative sequence number)
    Sequence number (raw): 888495061
    [Next sequence number: 3431    (relative sequence number)]
    Acknowledgment number: 518    (relative ack number)
    Acknowledgment number (raw): 295112499
    0101 .... = Header Length: 20 bytes (5)
    Flags: 0x018 (PSH, ACK)
    Window size value: 64240
    [Calculated window size: 64240]
    [Window size scaling factor: -2 (no window scaling used)]
    Checksum: 0xd69c [unverified]
    [Checksum Status: Unverified]
    Urgent pointer: 0
    [SEQ/ACK analysis]
        [iRTT: 0.032211853 seconds]
        [Bytes in flight: 3430]
        [Bytes sent since last PSH flag: 3430]
    [Timestamps]
    TCP payload (3430 bytes)
Transport Layer Security
    TLSv1.3 Record Layer: Handshake Protocol: Server Hello
        Content Type: Handshake (22)
        Version: TLS 1.2 (0x0303)
        Length: 122
        Handshake Protocol: Server Hello
            Handshake Type: Server Hello (2)
            Length: 118
            Version: TLS 1.2 (0x0303)
            Random: e9c491f95e226d7da1383d3e829bbb3b177d599b66e847b0…
            Session ID Length: 32
            Session ID: 1e080e5f9564250abb7e3148d9228b2bde1c9ccc9581dfe0…
            Cipher Suite: TLS_AES_128_GCM_SHA256 (0x1301)
            Compression Method: null (0)
            Extensions Length: 46
            Extension: key_share (len=36)
            Extension: supported_versions (len=2)
    TLSv1.3 Record Layer: Change Cipher Spec Protocol: Change Cipher Spec
        Content Type: Change Cipher Spec (20)
        Version: TLS 1.2 (0x0303)
        Length: 1
        Change Cipher Spec Message
    TLSv1.3 Record Layer: Application Data Protocol: http-over-tls
        Opaque Type: Application Data (23)
        Version: TLS 1.2 (0x0303)
        Length: 3292
        Encrypted Application Data: d066915633bc820f070321aa0d762005bab68e32832fe3b9…

No.     Time           Source                Destination           Protocol Length Info
     13 0.090022852    192.168.21.128        34.120.208.123        TCP      54     32872 → 443 [ACK] Seq=518 Ack=3431 Win=61320 Len=0

Frame 13: 54 bytes on wire (432 bits), 54 bytes captured (432 bits) on interface eth0, id 0
Ethernet II, Src: VMware_8e:ef:60 (00:0c:29:8e:ef:60), Dst: VMware_fb:0a:68 (00:50:56:fb:0a:68)
Internet Protocol Version 4, Src: 192.168.21.128, Dst: 34.120.208.123
Transmission Control Protocol, Src Port: 32872, Dst Port: 443, Seq: 518, Ack: 3431, Len: 0
    Source Port: 32872
    Destination Port: 443
    [Stream index: 0]
    [TCP Segment Len: 0]
    Sequence number: 518    (relative sequence number)
    Sequence number (raw): 295112499
    [Next sequence number: 518    (relative sequence number)]
    Acknowledgment number: 3431    (relative ack number)
    Acknowledgment number (raw): 888498491
    0101 .... = Header Length: 20 bytes (5)
    Flags: 0x010 (ACK)
    Window size value: 61320
    [Calculated window size: 61320]
    [Window size scaling factor: -2 (no window scaling used)]
    Checksum: 0xc936 [unverified]
    [Checksum Status: Unverified]
    Urgent pointer: 0
    [SEQ/ACK analysis]
        [This is an ACK to the segment in frame: 12]
        [The RTT to ACK the segment was: 0.000026969 seconds]
        [iRTT: 0.032211853 seconds]
    [Timestamps]

No.     Time           Source                Destination           Protocol Length Info
     14 0.095102680    192.168.21.128        34.120.208.123        TLSv1.3  118    Change Cipher Spec, Application Data

Frame 14: 118 bytes on wire (944 bits), 118 bytes captured (944 bits) on interface eth0, id 0
Ethernet II, Src: VMware_8e:ef:60 (00:0c:29:8e:ef:60), Dst: VMware_fb:0a:68 (00:50:56:fb:0a:68)
Internet Protocol Version 4, Src: 192.168.21.128, Dst: 34.120.208.123
Transmission Control Protocol, Src Port: 32872, Dst Port: 443, Seq: 518, Ack: 3431, Len: 64
    Source Port: 32872
    Destination Port: 443
    [Stream index: 0]
    [TCP Segment Len: 64]
    Sequence number: 518    (relative sequence number)
    Sequence number (raw): 295112499
    [Next sequence number: 582    (relative sequence number)]
    Acknowledgment number: 3431    (relative ack number)
    Acknowledgment number (raw): 888498491
    0101 .... = Header Length: 20 bytes (5)
    Flags: 0x018 (PSH, ACK)
    Window size value: 62780
    [Calculated window size: 62780]
    [Window size scaling factor: -2 (no window scaling used)]
    Checksum: 0xc976 [unverified]
    [Checksum Status: Unverified]
    Urgent pointer: 0
    [SEQ/ACK analysis]
        [iRTT: 0.032211853 seconds]
        [Bytes in flight: 64]
        [Bytes sent since last PSH flag: 64]
    [Timestamps]
    TCP payload (64 bytes)
Transport Layer Security
    TLSv1.3 Record Layer: Change Cipher Spec Protocol: Change Cipher Spec
        Content Type: Change Cipher Spec (20)
        Version: TLS 1.2 (0x0303)
        Length: 1
        Change Cipher Spec Message
    TLSv1.3 Record Layer: Application Data Protocol: http-over-tls
        Opaque Type: Application Data (23)
        Version: TLS 1.2 (0x0303)
        Length: 53
        Encrypted Application Data: 180f25cf445587ba3a7f696d263afabc2e1ba003b0727aea…

No.     Time           Source                Destination           Protocol Length Info
     15 0.095255385    34.120.208.123        192.168.21.128        TCP      60     443 → 32872 [ACK] Seq=3431 Ack=582 Win=64240 Len=0

Frame 15: 60 bytes on wire (480 bits), 60 bytes captured (480 bits) on interface eth0, id 0
Ethernet II, Src: VMware_fb:0a:68 (00:50:56:fb:0a:68), Dst: VMware_8e:ef:60 (00:0c:29:8e:ef:60)
Internet Protocol Version 4, Src: 34.120.208.123, Dst: 192.168.21.128
Transmission Control Protocol, Src Port: 443, Dst Port: 32872, Seq: 3431, Ack: 582, Len: 0
    Source Port: 443
    Destination Port: 32872
    [Stream index: 0]
    [TCP Segment Len: 0]
    Sequence number: 3431    (relative sequence number)
    Sequence number (raw): 888498491
    [Next sequence number: 3431    (relative sequence number)]
    Acknowledgment number: 582    (relative ack number)
    Acknowledgment number (raw): 295112563
    0101 .... = Header Length: 20 bytes (5)
    Flags: 0x010 (ACK)
    Window size value: 64240
    [Calculated window size: 64240]
    [Window size scaling factor: -2 (no window scaling used)]
    Checksum: 0xaa69 [unverified]
    [Checksum Status: Unverified]
    Urgent pointer: 0
    [SEQ/ACK analysis]
        [This is an ACK to the segment in frame: 14]
        [The RTT to ACK the segment was: 0.000152705 seconds]
        [iRTT: 0.032211853 seconds]
    [Timestamps]

No.     Time           Source                Destination           Protocol Length Info
     16 0.114384685    192.168.21.128        34.120.208.123        TLSv1.3  224    Application Data

Frame 16: 224 bytes on wire (1792 bits), 224 bytes captured (1792 bits) on interface eth0, id 0
Ethernet II, Src: VMware_8e:ef:60 (00:0c:29:8e:ef:60), Dst: VMware_fb:0a:68 (00:50:56:fb:0a:68)
Internet Protocol Version 4, Src: 192.168.21.128, Dst: 34.120.208.123
Transmission Control Protocol, Src Port: 32872, Dst Port: 443, Seq: 582, Ack: 3431, Len: 170
    Source Port: 32872
    Destination Port: 443
    [Stream index: 0]
    [TCP Segment Len: 170]
    Sequence number: 582    (relative sequence number)
    Sequence number (raw): 295112563
    [Next sequence number: 752    (relative sequence number)]
    Acknowledgment number: 3431    (relative ack number)
    Acknowledgment number (raw): 888498491
    0101 .... = Header Length: 20 bytes (5)
    Flags: 0x018 (PSH, ACK)
    Window size value: 62780
    [Calculated window size: 62780]
    [Window size scaling factor: -2 (no window scaling used)]
    Checksum: 0xc9e0 [unverified]
    [Checksum Status: Unverified]
    Urgent pointer: 0
    [SEQ/ACK analysis]
        [iRTT: 0.032211853 seconds]
        [Bytes in flight: 170]
        [Bytes sent since last PSH flag: 170]
    [Timestamps]
    TCP payload (170 bytes)
Transport Layer Security
    TLSv1.3 Record Layer: Application Data Protocol: http-over-tls
        Opaque Type: Application Data (23)
        Version: TLS 1.2 (0x0303)
        Length: 165
        Encrypted Application Data: ad99c4787ec1a12d7083f9c2780932f77d0605bac6511179…

No.     Time           Source                Destination           Protocol Length Info
     17 0.114458057    192.168.21.128        34.120.208.123        TLSv1.3  417    Application Data

Frame 17: 417 bytes on wire (3336 bits), 417 bytes captured (3336 bits) on interface eth0, id 0
Ethernet II, Src: VMware_8e:ef:60 (00:0c:29:8e:ef:60), Dst: VMware_fb:0a:68 (00:50:56:fb:0a:68)
Internet Protocol Version 4, Src: 192.168.21.128, Dst: 34.120.208.123
Transmission Control Protocol, Src Port: 32872, Dst Port: 443, Seq: 752, Ack: 3431, Len: 363
    Source Port: 32872
    Destination Port: 443
    [Stream index: 0]
    [TCP Segment Len: 363]
    Sequence number: 752    (relative sequence number)
    Sequence number (raw): 295112733
    [Next sequence number: 1115    (relative sequence number)]
    Acknowledgment number: 3431    (relative ack number)
    Acknowledgment number (raw): 888498491
    0101 .... = Header Length: 20 bytes (5)
    Flags: 0x018 (PSH, ACK)
    Window size value: 62780
    [Calculated window size: 62780]
    [Window size scaling factor: -2 (no window scaling used)]
    Checksum: 0xcaa1 [unverified]
    [Checksum Status: Unverified]
    Urgent pointer: 0
    [SEQ/ACK analysis]
        [iRTT: 0.032211853 seconds]
        [Bytes in flight: 533]
        [Bytes sent since last PSH flag: 363]
    [Timestamps]
    TCP payload (363 bytes)
Transport Layer Security
    TLSv1.3 Record Layer: Application Data Protocol: http-over-tls
        Opaque Type: Application Data (23)
        Version: TLS 1.2 (0x0303)
        Length: 358
        Encrypted Application Data: add985b89b4253cafe8ad7d68939938a7db07879724995be…

No.     Time           Source                Destination           Protocol Length Info
     18 0.114525368    192.168.21.128        34.120.208.123        TLSv1.3  476    Application Data

Frame 18: 476 bytes on wire (3808 bits), 476 bytes captured (3808 bits) on interface eth0, id 0
Ethernet II, Src: VMware_8e:ef:60 (00:0c:29:8e:ef:60), Dst: VMware_fb:0a:68 (00:50:56:fb:0a:68)
Internet Protocol Version 4, Src: 192.168.21.128, Dst: 34.120.208.123
Transmission Control Protocol, Src Port: 32872, Dst Port: 443, Seq: 1115, Ack: 3431, Len: 422
    Source Port: 32872
    Destination Port: 443
    [Stream index: 0]
    [TCP Segment Len: 422]
    Sequence number: 1115    (relative sequence number)
    Sequence number (raw): 295113096
    [Next sequence number: 1537    (relative sequence number)]
    Acknowledgment number: 3431    (relative ack number)
    Acknowledgment number (raw): 888498491
    0101 .... = Header Length: 20 bytes (5)
    Flags: 0x018 (PSH, ACK)
    Window size value: 62780
    [Calculated window size: 62780]
    [Window size scaling factor: -2 (no window scaling used)]
    Checksum: 0xcadc [unverified]
    [Checksum Status: Unverified]
    Urgent pointer: 0
    [SEQ/ACK analysis]
        [iRTT: 0.032211853 seconds]
        [Bytes in flight: 955]
        [Bytes sent since last PSH flag: 422]
    [Timestamps]
    TCP payload (422 bytes)
Transport Layer Security
    TLSv1.3 Record Layer: Application Data Protocol: http-over-tls
        Opaque Type: Application Data (23)
        Version: TLS 1.2 (0x0303)
        Length: 417
        Encrypted Application Data: f7ae7a0e1eae609ccf9a7aa60fe47d1000f9a96cac56a545…

No.     Time           Source                Destination           Protocol Length Info
     19 0.114579319    34.120.208.123        192.168.21.128        TCP      60     443 → 32872 [ACK] Seq=3431 Ack=752 Win=64240 Len=0

Frame 19: 60 bytes on wire (480 bits), 60 bytes captured (480 bits) on interface eth0, id 0
Ethernet II, Src: VMware_fb:0a:68 (00:50:56:fb:0a:68), Dst: VMware_8e:ef:60 (00:0c:29:8e:ef:60)
Internet Protocol Version 4, Src: 34.120.208.123, Dst: 192.168.21.128
Transmission Control Protocol, Src Port: 443, Dst Port: 32872, Seq: 3431, Ack: 752, Len: 0
    Source Port: 443
    Destination Port: 32872
    [Stream index: 0]
    [TCP Segment Len: 0]
    Sequence number: 3431    (relative sequence number)
    Sequence number (raw): 888498491
    [Next sequence number: 3431    (relative sequence number)]
    Acknowledgment number: 752    (relative ack number)
    Acknowledgment number (raw): 295112733
    0101 .... = Header Length: 20 bytes (5)
    Flags: 0x010 (ACK)
    Window size value: 64240
    [Calculated window size: 64240]
    [Window size scaling factor: -2 (no window scaling used)]
    Checksum: 0xa9bf [unverified]
    [Checksum Status: Unverified]
    Urgent pointer: 0
    [SEQ/ACK analysis]
        [This is an ACK to the segment in frame: 16]
        [The RTT to ACK the segment was: 0.000194634 seconds]
        [iRTT: 0.032211853 seconds]
    [Timestamps]

No.     Time           Source                Destination           Protocol Length Info
     20 0.114579401    34.120.208.123        192.168.21.128        TCP      60     443 → 32872 [ACK] Seq=3431 Ack=1115 Win=64240 Len=0

Frame 20: 60 bytes on wire (480 bits), 60 bytes captured (480 bits) on interface eth0, id 0
Ethernet II, Src: VMware_fb:0a:68 (00:50:56:fb:0a:68), Dst: VMware_8e:ef:60 (00:0c:29:8e:ef:60)
Internet Protocol Version 4, Src: 34.120.208.123, Dst: 192.168.21.128
Transmission Control Protocol, Src Port: 443, Dst Port: 32872, Seq: 3431, Ack: 1115, Len: 0
    Source Port: 443
    Destination Port: 32872
    [Stream index: 0]
    [TCP Segment Len: 0]
    Sequence number: 3431    (relative sequence number)
    Sequence number (raw): 888498491
    [Next sequence number: 3431    (relative sequence number)]
    Acknowledgment number: 1115    (relative ack number)
    Acknowledgment number (raw): 295113096
    0101 .... = Header Length: 20 bytes (5)
    Flags: 0x010 (ACK)
    Window size value: 64240
    [Calculated window size: 64240]
    [Window size scaling factor: -2 (no window scaling used)]
    Checksum: 0xa854 [unverified]
    [Checksum Status: Unverified]
    Urgent pointer: 0
    [SEQ/ACK analysis]
        [This is an ACK to the segment in frame: 17]
        [The RTT to ACK the segment was: 0.000121344 seconds]
        [iRTT: 0.032211853 seconds]
    [Timestamps]

No.     Time           Source                Destination           Protocol Length Info
     21 0.114636963    34.120.208.123        192.168.21.128        TCP      60     443 → 32872 [ACK] Seq=3431 Ack=1537 Win=64240 Len=0

Frame 21: 60 bytes on wire (480 bits), 60 bytes captured (480 bits) on interface eth0, id 0
Ethernet II, Src: VMware_fb:0a:68 (00:50:56:fb:0a:68), Dst: VMware_8e:ef:60 (00:0c:29:8e:ef:60)
Internet Protocol Version 4, Src: 34.120.208.123, Dst: 192.168.21.128
Transmission Control Protocol, Src Port: 443, Dst Port: 32872, Seq: 3431, Ack: 1537, Len: 0
    Source Port: 443
    Destination Port: 32872
    [Stream index: 0]
    [TCP Segment Len: 0]
    Sequence number: 3431    (relative sequence number)
    Sequence number (raw): 888498491
    [Next sequence number: 3431    (relative sequence number)]
    Acknowledgment number: 1537    (relative ack number)
    Acknowledgment number (raw): 295113518
    0101 .... = Header Length: 20 bytes (5)
    Flags: 0x010 (ACK)
    Window size value: 64240
    [Calculated window size: 64240]
    [Window size scaling factor: -2 (no window scaling used)]
    Checksum: 0xa6ae [unverified]
    [Checksum Status: Unverified]
    Urgent pointer: 0
    [SEQ/ACK analysis]
        [This is an ACK to the segment in frame: 18]
        [The RTT to ACK the segment was: 0.000111595 seconds]
        [iRTT: 0.032211853 seconds]
    [Timestamps]

No.     Time           Source                Destination           Protocol Length Info
     24 0.149399971    34.120.208.123        192.168.21.128        TLSv1.3  634    Application Data, Application Data

Frame 24: 634 bytes on wire (5072 bits), 634 bytes captured (5072 bits) on interface eth0, id 0
Ethernet II, Src: VMware_fb:0a:68 (00:50:56:fb:0a:68), Dst: VMware_8e:ef:60 (00:0c:29:8e:ef:60)
Internet Protocol Version 4, Src: 34.120.208.123, Dst: 192.168.21.128
Transmission Control Protocol, Src Port: 443, Dst Port: 32872, Seq: 3431, Ack: 1537, Len: 580
    Source Port: 443
    Destination Port: 32872
    [Stream index: 0]
    [TCP Segment Len: 580]
    Sequence number: 3431    (relative sequence number)
    Sequence number (raw): 888498491
    [Next sequence number: 4011    (relative sequence number)]
    Acknowledgment number: 1537    (relative ack number)
    Acknowledgment number (raw): 295113518
    0101 .... = Header Length: 20 bytes (5)
    Flags: 0x018 (PSH, ACK)
    Window size value: 64240
    [Calculated window size: 64240]
    [Window size scaling factor: -2 (no window scaling used)]
    Checksum: 0x93df [unverified]
    [Checksum Status: Unverified]
    Urgent pointer: 0
    [SEQ/ACK analysis]
        [iRTT: 0.032211853 seconds]
        [Bytes in flight: 580]
        [Bytes sent since last PSH flag: 580]
    [Timestamps]
    TCP payload (580 bytes)
Transport Layer Security
    TLSv1.3 Record Layer: Application Data Protocol: http-over-tls
        Opaque Type: Application Data (23)
        Version: TLS 1.2 (0x0303)
        Length: 513
        Encrypted Application Data: 6e65a12e18625518393aad317950a673ba0ecd540b4a472e…
    TLSv1.3 Record Layer: Application Data Protocol: http-over-tls
        Opaque Type: Application Data (23)
        Version: TLS 1.2 (0x0303)
        Length: 57
        Encrypted Application Data: 9c79e07d5600b85c8298c822ef9a3ee61adf85251ea3fb08…

No.     Time           Source                Destination           Protocol Length Info
     25 0.149414322    192.168.21.128        34.120.208.123        TCP      54     32872 → 443 [ACK] Seq=1537 Ack=4011 Win=62780 Len=0

Frame 25: 54 bytes on wire (432 bits), 54 bytes captured (432 bits) on interface eth0, id 0
Ethernet II, Src: VMware_8e:ef:60 (00:0c:29:8e:ef:60), Dst: VMware_fb:0a:68 (00:50:56:fb:0a:68)
Internet Protocol Version 4, Src: 192.168.21.128, Dst: 34.120.208.123
Transmission Control Protocol, Src Port: 32872, Dst Port: 443, Seq: 1537, Ack: 4011, Len: 0
    Source Port: 32872
    Destination Port: 443
    [Stream index: 0]
    [TCP Segment Len: 0]
    Sequence number: 1537    (relative sequence number)
    Sequence number (raw): 295113518
    [Next sequence number: 1537    (relative sequence number)]
    Acknowledgment number: 4011    (relative ack number)
    Acknowledgment number (raw): 888499071
    0101 .... = Header Length: 20 bytes (5)
    Flags: 0x010 (ACK)
    Window size value: 62780
    [Calculated window size: 62780]
    [Window size scaling factor: -2 (no window scaling used)]
    Checksum: 0xc936 [unverified]
    [Checksum Status: Unverified]
    Urgent pointer: 0
    [SEQ/ACK analysis]
        [This is an ACK to the segment in frame: 24]
        [The RTT to ACK the segment was: 0.000014351 seconds]
        [iRTT: 0.032211853 seconds]
    [Timestamps]

No.     Time           Source                Destination           Protocol Length Info
     26 0.149845248    192.168.21.128        34.120.208.123        TLSv1.3  85     Application Data

Frame 26: 85 bytes on wire (680 bits), 85 bytes captured (680 bits) on interface eth0, id 0
Ethernet II, Src: VMware_8e:ef:60 (00:0c:29:8e:ef:60), Dst: VMware_fb:0a:68 (00:50:56:fb:0a:68)
Internet Protocol Version 4, Src: 192.168.21.128, Dst: 34.120.208.123
Transmission Control Protocol, Src Port: 32872, Dst Port: 443, Seq: 1537, Ack: 4011, Len: 31
    Source Port: 32872
    Destination Port: 443
    [Stream index: 0]
    [TCP Segment Len: 31]
    Sequence number: 1537    (relative sequence number)
    Sequence number (raw): 295113518
    [Next sequence number: 1568    (relative sequence number)]
    Acknowledgment number: 4011    (relative ack number)
    Acknowledgment number (raw): 888499071
    0101 .... = Header Length: 20 bytes (5)
    Flags: 0x018 (PSH, ACK)
    Window size value: 62780
    [Calculated window size: 62780]
    [Window size scaling factor: -2 (no window scaling used)]
    Checksum: 0xc955 [unverified]
    [Checksum Status: Unverified]
    Urgent pointer: 0
    [SEQ/ACK analysis]
        [iRTT: 0.032211853 seconds]
        [Bytes in flight: 31]
        [Bytes sent since last PSH flag: 31]
    [Timestamps]
    TCP payload (31 bytes)
Transport Layer Security
    TLSv1.3 Record Layer: Application Data Protocol: http-over-tls
        Opaque Type: Application Data (23)
        Version: TLS 1.2 (0x0303)
        Length: 26
        Encrypted Application Data: 37383e498d541c676a9e94dec16b5be01a57a2da1ed5c0e3…

No.     Time           Source                Destination           Protocol Length Info
     27 0.149948318    34.120.208.123        192.168.21.128        TCP      60     443 → 32872 [ACK] Seq=4011 Ack=1568 Win=64240 Len=0

Frame 27: 60 bytes on wire (480 bits), 60 bytes captured (480 bits) on interface eth0, id 0
Ethernet II, Src: VMware_fb:0a:68 (00:50:56:fb:0a:68), Dst: VMware_8e:ef:60 (00:0c:29:8e:ef:60)
Internet Protocol Version 4, Src: 34.120.208.123, Dst: 192.168.21.128
Transmission Control Protocol, Src Port: 443, Dst Port: 32872, Seq: 4011, Ack: 1568, Len: 0
    Source Port: 443
    Destination Port: 32872
    [Stream index: 0]
    [TCP Segment Len: 0]
    Sequence number: 4011    (relative sequence number)
    Sequence number (raw): 888499071
    [Next sequence number: 4011    (relative sequence number)]
    Acknowledgment number: 1568    (relative ack number)
    Acknowledgment number (raw): 295113549
    0101 .... = Header Length: 20 bytes (5)
    Flags: 0x010 (ACK)
    Window size value: 64240
    [Calculated window size: 64240]
    [Window size scaling factor: -2 (no window scaling used)]
    Checksum: 0xa44b [unverified]
    [Checksum Status: Unverified]
    Urgent pointer: 0
    [SEQ/ACK analysis]
        [This is an ACK to the segment in frame: 26]
        [The RTT to ACK the segment was: 0.000103070 seconds]
        [iRTT: 0.032211853 seconds]
    [Timestamps]

No.     Time           Source                Destination           Protocol Length Info
     28 0.179448274    34.120.208.123        192.168.21.128        TLSv1.3  85     Application Data

Frame 28: 85 bytes on wire (680 bits), 85 bytes captured (680 bits) on interface eth0, id 0
Ethernet II, Src: VMware_fb:0a:68 (00:50:56:fb:0a:68), Dst: VMware_8e:ef:60 (00:0c:29:8e:ef:60)
Internet Protocol Version 4, Src: 34.120.208.123, Dst: 192.168.21.128
Transmission Control Protocol, Src Port: 443, Dst Port: 32872, Seq: 4011, Ack: 1568, Len: 31
    Source Port: 443
    Destination Port: 32872
    [Stream index: 0]
    [TCP Segment Len: 31]
    Sequence number: 4011    (relative sequence number)
    Sequence number (raw): 888499071
    [Next sequence number: 4042    (relative sequence number)]
    Acknowledgment number: 1568    (relative ack number)
    Acknowledgment number (raw): 295113549
    0101 .... = Header Length: 20 bytes (5)
    Flags: 0x018 (PSH, ACK)
    Window size value: 64240
    [Calculated window size: 64240]
    [Window size scaling factor: -2 (no window scaling used)]
    Checksum: 0x489b [unverified]
    [Checksum Status: Unverified]
    Urgent pointer: 0
    [SEQ/ACK analysis]
        [iRTT: 0.032211853 seconds]
        [Bytes in flight: 31]
        [Bytes sent since last PSH flag: 31]
    [Timestamps]
    TCP payload (31 bytes)
Transport Layer Security
    TLSv1.3 Record Layer: Application Data Protocol: http-over-tls
        Opaque Type: Application Data (23)
        Version: TLS 1.2 (0x0303)
        Length: 26
        Encrypted Application Data: 61d3d16b7b1c68d17275036f6e53e1a57828242bc3f40e5c…

No.     Time           Source                Destination           Protocol Length Info
     29 0.179478040    192.168.21.128        34.120.208.123        TCP      54     32872 → 443 [ACK] Seq=1568 Ack=4042 Win=62780 Len=0

Frame 29: 54 bytes on wire (432 bits), 54 bytes captured (432 bits) on interface eth0, id 0
Ethernet II, Src: VMware_8e:ef:60 (00:0c:29:8e:ef:60), Dst: VMware_fb:0a:68 (00:50:56:fb:0a:68)
Internet Protocol Version 4, Src: 192.168.21.128, Dst: 34.120.208.123
Transmission Control Protocol, Src Port: 32872, Dst Port: 443, Seq: 1568, Ack: 4042, Len: 0
    Source Port: 32872
    Destination Port: 443
    [Stream index: 0]
    [TCP Segment Len: 0]
    Sequence number: 1568    (relative sequence number)
    Sequence number (raw): 295113549
    [Next sequence number: 1568    (relative sequence number)]
    Acknowledgment number: 4042    (relative ack number)
    Acknowledgment number (raw): 888499102
    0101 .... = Header Length: 20 bytes (5)
    Flags: 0x010 (ACK)
    Window size value: 62780
    [Calculated window size: 62780]
    [Window size scaling factor: -2 (no window scaling used)]
    Checksum: 0xc936 [unverified]
    [Checksum Status: Unverified]
    Urgent pointer: 0
    [SEQ/ACK analysis]
        [This is an ACK to the segment in frame: 28]
        [The RTT to ACK the segment was: 0.000029766 seconds]
        [iRTT: 0.032211853 seconds]
    [Timestamps]

No.     Time           Source                Destination           Protocol Length Info
     30 0.388606708    34.120.208.123        192.168.21.128        TLSv1.3  505    Application Data

Frame 30: 505 bytes on wire (4040 bits), 505 bytes captured (4040 bits) on interface eth0, id 0
Ethernet II, Src: VMware_fb:0a:68 (00:50:56:fb:0a:68), Dst: VMware_8e:ef:60 (00:0c:29:8e:ef:60)
Internet Protocol Version 4, Src: 34.120.208.123, Dst: 192.168.21.128
Transmission Control Protocol, Src Port: 443, Dst Port: 32872, Seq: 4042, Ack: 1568, Len: 451
    Source Port: 443
    Destination Port: 32872
    [Stream index: 0]
    [TCP Segment Len: 451]
    Sequence number: 4042    (relative sequence number)
    Sequence number (raw): 888499102
    [Next sequence number: 4493    (relative sequence number)]
    Acknowledgment number: 1568    (relative ack number)
    Acknowledgment number (raw): 295113549
    0101 .... = Header Length: 20 bytes (5)
    Flags: 0x018 (PSH, ACK)
    Window size value: 64240
    [Calculated window size: 64240]
    [Window size scaling factor: -2 (no window scaling used)]
    Checksum: 0x8ae9 [unverified]
    [Checksum Status: Unverified]
    Urgent pointer: 0
    [SEQ/ACK analysis]
        [iRTT: 0.032211853 seconds]
        [Bytes in flight: 451]
        [Bytes sent since last PSH flag: 451]
    [Timestamps]
    TCP payload (451 bytes)
Transport Layer Security
    TLSv1.3 Record Layer: Application Data Protocol: http-over-tls
        Opaque Type: Application Data (23)
        Version: TLS 1.2 (0x0303)
        Length: 446
        Encrypted Application Data: ffd2eb8443bb9ae2c276a9078e446400b56a361b61ed3446…

No.     Time           Source                Destination           Protocol Length Info
     31 0.388628945    192.168.21.128        34.120.208.123        TCP      54     32872 → 443 [ACK] Seq=1568 Ack=4493 Win=62780 Len=0

Frame 31: 54 bytes on wire (432 bits), 54 bytes captured (432 bits) on interface eth0, id 0
Ethernet II, Src: VMware_8e:ef:60 (00:0c:29:8e:ef:60), Dst: VMware_fb:0a:68 (00:50:56:fb:0a:68)
Internet Protocol Version 4, Src: 192.168.21.128, Dst: 34.120.208.123
Transmission Control Protocol, Src Port: 32872, Dst Port: 443, Seq: 1568, Ack: 4493, Len: 0
    Source Port: 32872
    Destination Port: 443
    [Stream index: 0]
    [TCP Segment Len: 0]
    Sequence number: 1568    (relative sequence number)
    Sequence number (raw): 295113549
    [Next sequence number: 1568    (relative sequence number)]
    Acknowledgment number: 4493    (relative ack number)
    Acknowledgment number (raw): 888499553
    0101 .... = Header Length: 20 bytes (5)
    Flags: 0x010 (ACK)
    Window size value: 62780
    [Calculated window size: 62780]
    [Window size scaling factor: -2 (no window scaling used)]
    Checksum: 0xc936 [unverified]
    [Checksum Status: Unverified]
    Urgent pointer: 0
    [SEQ/ACK analysis]
        [This is an ACK to the segment in frame: 30]
        [The RTT to ACK the segment was: 0.000022237 seconds]
        [iRTT: 0.032211853 seconds]
    [Timestamps]

No.     Time           Source                Destination           Protocol Length Info
     32 0.388944530    192.168.21.128        34.120.208.123        TLSv1.3  93     Application Data

Frame 32: 93 bytes on wire (744 bits), 93 bytes captured (744 bits) on interface eth0, id 0
Ethernet II, Src: VMware_8e:ef:60 (00:0c:29:8e:ef:60), Dst: VMware_fb:0a:68 (00:50:56:fb:0a:68)
Internet Protocol Version 4, Src: 192.168.21.128, Dst: 34.120.208.123
Transmission Control Protocol, Src Port: 32872, Dst Port: 443, Seq: 1568, Ack: 4493, Len: 39
    Source Port: 32872
    Destination Port: 443
    [Stream index: 0]
    [TCP Segment Len: 39]
    Sequence number: 1568    (relative sequence number)
    Sequence number (raw): 295113549
    [Next sequence number: 1607    (relative sequence number)]
    Acknowledgment number: 4493    (relative ack number)
    Acknowledgment number (raw): 888499553
    0101 .... = Header Length: 20 bytes (5)
    Flags: 0x018 (PSH, ACK)
    Window size value: 62780
    [Calculated window size: 62780]
    [Window size scaling factor: -2 (no window scaling used)]
    Checksum: 0xc95d [unverified]
    [Checksum Status: Unverified]
    Urgent pointer: 0
    [SEQ/ACK analysis]
        [iRTT: 0.032211853 seconds]
        [Bytes in flight: 39]
        [Bytes sent since last PSH flag: 39]
    [Timestamps]
    TCP payload (39 bytes)
Transport Layer Security
    TLSv1.3 Record Layer: Application Data Protocol: http-over-tls
        Opaque Type: Application Data (23)
        Version: TLS 1.2 (0x0303)
        Length: 34
        Encrypted Application Data: 431d2c02b9d5808700415c73ac499f48ec9a2a8b55a5dee7…

No.     Time           Source                Destination           Protocol Length Info
     33 0.389138112    34.120.208.123        192.168.21.128        TCP      60     443 → 32872 [ACK] Seq=4493 Ack=1607 Win=64240 Len=0

Frame 33: 60 bytes on wire (480 bits), 60 bytes captured (480 bits) on interface eth0, id 0
Ethernet II, Src: VMware_fb:0a:68 (00:50:56:fb:0a:68), Dst: VMware_8e:ef:60 (00:0c:29:8e:ef:60)
Internet Protocol Version 4, Src: 34.120.208.123, Dst: 192.168.21.128
Transmission Control Protocol, Src Port: 443, Dst Port: 32872, Seq: 4493, Ack: 1607, Len: 0
    Source Port: 443
    Destination Port: 32872
    [Stream index: 0]
    [TCP Segment Len: 0]
    Sequence number: 4493    (relative sequence number)
    Sequence number (raw): 888499553
    [Next sequence number: 4493    (relative sequence number)]
    Acknowledgment number: 1607    (relative ack number)
    Acknowledgment number (raw): 295113588
    0101 .... = Header Length: 20 bytes (5)
    Flags: 0x010 (ACK)
    Window size value: 64240
    [Calculated window size: 64240]
    [Window size scaling factor: -2 (no window scaling used)]
    Checksum: 0xa242 [unverified]
    [Checksum Status: Unverified]
    Urgent pointer: 0
    [SEQ/ACK analysis]
        [This is an ACK to the segment in frame: 32]
        [The RTT to ACK the segment was: 0.000193582 seconds]
